"room","idx","original","translated","comments"
"0.0","0.0","","",""
"0.0","1.0","The Colonel's Bequest","עזבונו של הקולונל",""
"0.0","2.0","%s","",""
"0.0","3.0","empty cracker box","קופסת קרקרים ריקה",""
"0.0","4.0","%u%s","",""
"0.0","5.0"," cracker ","קרקר",""
"0.0","6.0"," crackers ","קרקרים",""
"0.0","7.0","loaded gun ","אקדח טעון",""
"0.0","8.0","derringer  ","אקדח דרינג'ר",""
"0.0","9.0","You're not close enough.","את לא קרובה מספיק.",""
"0.0","10.0","You already took it.","כבר לקחת את זה.",""
"0.0","11.0","It is already open.","זה כבר פתוח.",""
"0.0","12.0","It is already closed.","זה כבר סגור.",""
"0.0","13.0","You see nothing special.","את לא רואה שום דבר מיוחד.",""
"0.0","14.0","You can't do that.","את לא יכולה לעשות את זה.",""
"0.0","15.0","You don't have it.","אין לך את זה.",""
"0.0","16.0","You don't see it here.","את לא רואה את זה כאן.",""
"0.0","17.0","Okay.","בסדר.",""
"0.0","18.0","It is very difficult to talk to two people at once.","זה מאוד מסובך לדבר עם שני אנשים בו זמנית.",""
"1.0","0.0","A weather-beaten dock extends from the island's edge out into the alligator-infested bayou. Toward the center of the island you can see the old plantation house.","רציף שחוק נמתח מקצהו של האי אל עבר הביצה שורצת התנינים. בקרבת מרכז האי את רואה את בית האחוזה הישן.",""
"1.0","1.0","You could never lift those heavy crates!","לעולם לא תצליחי להרים את התיבות הכבדות האלה!",""
"1.0","2.0","There is nothing you would want in these old crates.","אין שום דבר שהיית רוצה בתוך התיבות הישנות.",""
"1.0","3.0","All you see under the dock is swamp water.","כל שאת רואה מתחת לרציף הוא מי ביצה.",""
"1.0","4.0","Old crates are piled at the end of the dock.","תיבות ישנות נערמו בקצה הרציף.",""
"1.0","5.0","The thick muck was too much for you.","הבוץ הסמיך היה יותר מדי עבורך.",""
"1.0","6.0","Many frogs and turtles live in the bayou.","הרבה צפרדעים וצבים חיים בביצה.",""
"1.0","7.0","You have better things to do than to worry about the little swamp creatures.","יש לך דברים טובים יותר לעשות מלדאוג לגבי יצורי ביצה קטנים.",""
"1.0","8.0","This isn't King's Quest!","כאן זה לא מסע המלך!",""
"1.0","9.0","What do you think this is...King's Quest?!","מה את חושבת שזה... מסע המלך?!",""
"1.0","10.0","You'd have to catch them first.","תצטרכי לתפוס אותם קודם.",""
"1.0","11.0","Vicious 'gators inhabit the swamp surrounding the island.","תנינים אכזריים שוכנים בביצה שסובבת את האי.",""
"1.0","12.0","These alligators prefer fresh meat. Heh, heh.","התנינים האלה מעדיפים בשר טרי. חה, חה.",""
"1.0","13.0","You MUST be kidding!","את צוחקת!",""
"1.0","14.0","You can't be SERIOUS!","את לא באמת רצינית!",""
"1.0","15.0","'Gators don't talk!","תנינים לא יכולים לדבר!",""
"1.0","16.0","Be reasonable!!","תהיי הגיונית!!",""
"1.0","17.0","You couldn't hurt a big 'gator.","את לא תצליחי לפגוע בתנין גדול.",""
"2.0","0.0","This is an old, family graveyard behind the little chapel. Set among the various family graves and monuments, you notice two large tombs.","זהו בית קברות משפחתי ישן הניצב מאחורי הכנסייה הקטנה. את מבחינה בשני קברים גדולים בין מגוון המצבות והאנדרטות.",""
"2.0","1.0","You must enter the tomb to do that.","עלייך להיכנס לקבר כדי לעשות זאת.",""
"2.0","2.0","The tomb door is sealed. You can't enter it.","הדלת של הקבר אטומה. את לא יכולה להיכנס.",""
"2.0","3.0","The tomb door isn't locked.","הדלת של הקבר אינה נעולה.",""
"2.0","4.0","There is no keyhole, or handle, to the tomb door. It is sealed from the inside.","אין חור מנעול, או ידית, לדלת של הקבר. היא אטומה מבפנים.",""
"2.0","5.0","The tomb door is firmly sealed. No matter what you do, you cannot open it.","הדלת של הקבר אטומה בחוזקה. לא משנה מה תעשי, לא תצליחי לפתוח אותה.",""
"2.0","6.0","One tomb has the name DIJON carved over the door and CROUTON has been inscribed over the door of the other.","השם 'דיז'ון' חרוט מעל דלתו של קבר אחד ו'קרוטון' רשום מעל הדלת של השני.",""
"2.0","7.0","Each gravestone is dedicated to a member of the Crouton family.","כל אחת מהמצבות מוקדשת לבן משפחת קרוטון.",""
"2.0","8.0","A path leads to the chapel from the cemetery.","שביל מוביל מהכנסייה לעבר בית הקברות.",""
"2.0","9.0","You don't really believe in ghosts, do you?!","את לא באמת מאמינה ברוחות רפאים, נכון?!",""
"2.0","10.0","You see several graves and monuments on the ground.","את רואה כמה קברים ואנדרטות על הקרקע.",""
"2.0","11.0","The graves and monuments belong to various members of the Crouton family, ranging from the large monument of patriarch, Francois Crouton and his wife Claudette, to the simple grave of Sarah Crouton, who was 17 when she died in 1871.","הקברים והמצבות שייכים לבני משפחת קרוטון לדורותיהם, החל מהאנדרטה הגדולה של אבי המשפחה פרנסיס קרוטון ואשתו קלודט, ועד לקברה הפשוט של שרה קרוטון, אשר היתה בת 17 במותה בשנת 1871.",""
"2.0","12.0","Granite slabs form the tomb doors.","לוחות שחם יוצרים את דלתות הקבר.",""
"2.0","13.0","A rusted, wrought iron fence surrounds the old, family cemetery.","גדר ברזל חלודה מקיפה את בית העלמין המשפחתי העתיק.",""
"2.0","14.0","There is a gate leading into the cemetery.","שער מוביל אל תוככי בית הקברות.",""
"2.0","15.0","The small chapel accompanies the old cemetery.","כנסייה קטנה שוכנת בבית הקברות העתיק.",""
"2.0","16.0","The graves all seem to belong to the Crouton family.","דומה שכל הקברים משתייכים למשפחת קרוטון.",""
"2.0","17.0","None of the gravestones move. They are firmly planted in the ground.","אף לא אחת מהמצבות זזה. הן כולן נטועות עמוק באדמה.",""
"2.0","18.0","Be serious! This is no time for a seance!","תהיי רצינית! עכשיו זה לא הזמן לסיאנס!",""
"2.0","19.0","The fence is too difficult to climb.","יהיה קשה מדי לטפס על הגדר.",""
"2.0","20.0","The gate seems to be stuck in place.","נראה שהשער תקוע במקומו.",""
"2.0","21.0","Cautiously, you look inside the tomb.","בזהירות, את מסתכלת לתוך הקבר.",""
"2.0","22.0","Currently, it's just an empty tomb. One day, this will be the final resting place of Colonel Dijon.","כרגע זה פשוט קבר ריק. ביום מן הימים הוא יהפוך למקום מנוחתו האחרון של קולונל דיז'ון.",""
"2.0","23.0","You knock loudly on the tomb door and wait...","את דופקת ברעש על דלת הקבר ומחכה...",""
"2.0","24.0","No answer.","אין תשובה.",""
"2.0","25.0","It looks like a new metal door.","נראה כמו דלת מתכת חדשה.",""
"2.0","26.0","That looks like a wisp of mist from the bayou.","נראה כמו סליל ערפל מן הביצה.",""
"3.0","0.0","You see a rusted, iron bell at the top of an old, bell tower. A rope dangles a short distance beneath the bell while a ladder runs up the tower's side. Behind a weathered fence, you also notice the remnants of the old plantation's fields.","את רואה פעמון מתכת חלוד בראש מגדל פעמון נושן. חבל קצר מתנודד בתחתית הפעמון בעוד סולם מטפס מעלה לצד המגדל. מאחורי גדר חבוטה, את מבחינה גם בשרידיהם של שדות האחוזה.",""
"3.0","1.0","A rope dangles a short distance dwon from the tower while a ladder runs up the tower's side. Behind a weathered fence, you also notice the remnants of the old plantation's fields.","חבל קצר משתלשל מראש המגדל בעוד סולם מטפס מעלה לצד המגדל. מאחורי גדר חבוטה, את מבחינה גם בשרידיהם של שדות האחוזה.",""
"3.0","2.0","The rope dangles a short distance above you.","החבל משתלשל מעט מעלייך.",""
"3.0","3.0","The rope dangles a short distance above you. Higher up, you see the old bell.","החבל משתלשל מעט מעלייך. גבוה יותר, את רואה את הפעמון הישן.",""
"3.0","4.0","A path travels by the old bell tower.","שביל עובר ליד מגדל הפעמון הישן.",""
"3.0","5.0","Behind a weather-beaten fence, you see the old, unused sugar cane fields. The fields look as if they haven't been planted in years.","מאחורי גדר ששיני הזמן נגסו בה, את רואה מטע נטוש של קני סוכר. דומה כי כבר שנים רבות לא ניטעו כאן יבולים חדשים.",""
"3.0","6.0","An old weather-beaten fence partitions off the remaining vestiges of the plantation's once-vast sugar cane fields. Now, all that's left are long-ago plowed furrows and old dead stalks.","גדר ישנה מוכת פגעי הזמן והטבע מחלקת את שרידיהם האחרונים של מטעי קני סוכר נרחבים שהיו ואינם. כעת, כל שנותר הם תלמים חרוצים משכבר ימים וגבעולים יבשים, מתים.",""
"3.0","7.0","You don't see a gate here.","אינך רואה כאן שער.",""
"3.0","8.0","All you see is the old, rusted bell.","כל שאת רואה זהו פעמון חלוד, ישן.",""
"3.0","9.0","You can't see into the bell tower from here.","אינך יכולה לראות מכאן את פנים מגדל הפעמון.",""
"3.0","10.0","You see a rusted iron bell at the top of an old bell tower. A rope dangles a short distance beneath the bell while a ladder runs up the tower's side.","את רואה פעמון מתכת חלוד בראש מגדל פעמון נושן. חבל קצר מתנודד מתחת לפעמון בעוד סולם מטפס מעלה לצד המגדל.",""
"3.0","11.0","The fence is too difficult to climb. Besides, you don't care about those old fields.","הגדר אינה קלה לטיפוס. ובכלל, אינך מתעניינת בשדות הנטושים האלה.",""
"3.0","12.0","You're not in a position to do that.","את לא נמצאת בעמדה לעשות את זה.",""
"3.0","13.0","You have no way of doing that.","אין לך אף דרך לעשות את זה.",""
"3.0","14.0","The bell has been oiled.","הפעמון שומן.",""
"3.0","15.0","Oiling the rusted bell may have loosened it.","השימון של הפעמון החלוד שחרר אותו.",""
"3.0","16.0","Reaching up with the cane you hook it onto the short rope's iron ring and PULL...","את מושיטה את המקל למעלה, תופסת איתו את הטבעת המחוברת לחבל ומושכת...",""
"3.0","17.0","...Nothing happens. Oh! The bell's too rusted to move!","...כלום לא קורה. אוי! הפעמון חלוד מכדי לזוז!",""
"3.0","18.0","Uh, oh!!","אוי, לא!!",""
"3.0","19.0","Look out! It's falling...!","תיזהרי! הוא נופל...!",""
"3.0","20.0","Whew! That was close!","וואו! זה היה קרוב.",""
"3.0","21.0","Now you're a real southern belle.","עכשיו את יפהפייה דרומית נרדמת.",""
"3.0","22.0","You reach up and try to grab the ring attached to the end of the rope...","את מנסה לתפוס את הטבעת שמחוברת לקצה החבל...",""
"3.0","23.0","...but the short rope is too high for you to reach the ring.","...אבל החבל הקצר גבוה מדי מכדי שתוכלי להגיע לטבעת.",""
"3.0","24.0","Okay. Thinking it might be useful, you remove the crank from the bell and take it with you.","בסדר, במחשבה שהיא תהיה שימושית, את מסירה את הארכובה מהפעמון ולוקחת אותה איתך.",""
"3.0","25.0","You see nothing there.","את לא רואה שם כלום.",""
"3.0","26.0","You cannot look into the bell from here.","את לא יכולה להסתכל לתוך הפעמון מכאן.",""
"3.0","27.0","You don't see a crank here.","את לא רואה כאן ידית.",""
"3.0","28.0","You could never carry around that big bell!","לעולם לא תצליחי לסחוב את הפעמון הגדול הזה!",""
"3.0","29.0","You can't ring the bell now!","את לא יכולה לצלצל בפעמון עכשיו!",""
"3.0","30.0","That would not do any good.","זה לא יועיל בכלום.",""
"3.0","31.0","You need to pull on the rope to ring the bell.","את צריכה למשוך בחבל כדי לצלצל בפעמון.",""
"3.0","32.0","What's that attached to the bell?! Hmmmm. It's some sort of old metal crank.","מה זה מחובר לפעמון?! הממממ. נראית כמו ארכובה ישנה ממתכת.",""
"3.0","33.0","It's just an old, rusted, iron bell.","זה רק פעמון מתכת ישן וחלוד.",""
"3.0","34.0","Dusty cobwebs cover the old bell that over years has rusted in place.","קורי עכביש מלאי אבק מכסים את הפעמון הישן, שעם השנים החליד ונתקע במקומו.",""
"3.0","35.0","A short rope hangs slightly below the old bell tower. There is a rusty, iron ring attached to the bottom of it.","חבל קצר תלוי מתחת למגדל הפעמון הישן. טבעת ברזל חלודה מחוברת בתחתית שלו.",""
"3.0","36.0","You scared away a bat!","הפחדת מכאן עטלף!",""
"3.0","37.0","You don't want a bat.","את לא רוצה עטלף.",""
"3.0","38.0","A rickety ladder runs up the side of the old bell tower.","סולם רעוע נמצא בצדו של מגדל הפעמון הישן.",""
"4.0","0.0","Out the back door, a garden path encircles a small statue, then continues on through a lovely rose arbor.","מעבר לדלת האחורית, שביל הגן מקיף פסל קטן ומשם ממשיך לעבר סוכת ורדים חביבה.",""
"4.0","1.0","You see a lovely rose garden in the distance to the north.","את רואה גן ורדים מקסים במרחק בכיוון צפון.",""
"4.0","2.0","Grecian columns enclose the small back porch. From here, you can see a lovely rose arbor.","עמודים יווניים תוחמים את המרפסת האחורית הקטנה. מכאן, את רואה סוכת ורדים מלבלבת.",""
"4.0","3.0","Behind a weather-beaten fence, you see the old, unused sugar cane fields. The fields look as if they haven't been planted in years.","מאחורי גדר ששיני הזמן נגסו בה, את רואה מטע נטוש של קני סוכר. דומה כי כבר שנים רבות לא ניטעו כאן יבולים חדשים.",""
"4.0","4.0","The garden path circles a small statue, then goes through a lovely rose arbor.","שביל הגן סובב סביב פסל קטן, ומשם ממשיך לעבר סוכת ורדים חביבה.",""
"4.0","5.0","Here, you see the back door of the house.","כאן, את רואה את דלת הבית האחורית.",""
"4.0","6.0","An old, weather-beaten fence partitions off the remaining vestiges of the plantation's once-vast sugar cane fields. Now all that's left are long-ago plowed furrows and old dead stalks.","גדר ישנה ודהויה מחלקת את השרידים הנותרים של מה שהיו פעם שדות קנה הסוכר הנרחבים של האחוזה. כעת כל שנותר הם תלמים שנחרשו מזמן וגבעולים מתים.",""
"4.0","7.0","You don't see a gate here.","אינך רואה כאן שער.",""
"4.0","8.0","Beautiful roses grow upon the rose arbor.","שושנים ורודות צומחות על גבי סוכת הורדים.",""
"4.0","9.0","You see no need to carry around a rose.","את לא רואה צורך בלקחת איתך ורד.",""
"4.0","10.0","The fence is too difficult to climb. Besides, you don't care about those old fields.","הגדר אינה קלה לטיפוס. ובכלל, אינך מתעניינת באותן שדות נטושות.",""
"4.0","11.0","The roses smell wonderful in the night air.","הוורדים מריחים נפלא באוויר הלילי.",""
"4.0","12.0","There are two garden benches here.","יש כאן שני ספסלי גינה.",""
"4.0","13.0","There is nothing but grass under the benches.","אין דבר פרט לדשא מתחת לספסלים.",""
"4.0","14.0","You don't feel like sitting around.","לא מתחשק לך לשבת.",""
"4.0","15.0","This is an exquisite statue of a dancing satyr.","זה פסל מרהיב של סאטיר רוקד.",""
"4.0","16.0","The statue is firmly afixed to its pedestal.","הפסל מחובר היטב לבסיסו.",""
"4.0","17.0","The statue doesn't move.","הפסל לא זז.",""
"4.0","18.0","Grecian columns support the back porch.","עמודים יווניים תומכים במרפסת האחורית.",""
"5.0","0.0","This is a wonderful little garden. You wonder who planted it; certainly not the Colonel!","זה גן קטן ונהדר. את תוהה מי שתל אותו; בטח לא הקולונל!",""
"5.0","1.0","A garden path leads south through a beautiful tunnel of roses.","שביל גן עובר דרומה דרך מנהרת ורדים יפהפייה.",""
"5.0","2.0","From here, the garden path goes south through a lovely rose arbor.","בהמשך, השביל ממשיך דרומה דרך סוכת ורדים מקסימה.",""
"5.0","3.0","Roses surround the little, heart-shaped garden.","ורדים מקיפים את הגן הקטן.",""
"5.0","4.0","An old, weather-beaten fence partitions off the remaining vestiges of the plantation's once-vast sugar cane fields. Now all that's left are long-ago plowed furrows and old dead stalks.","גדר ישנה ודהויה מחלקת את השרידים הנותרים של מה שהיו פעם שדות קנה הסוכר הנרחבים של האחוזה. כעת כל שנותר הם תלמים שנחרשו מזמן וגבעולים מתים.",""
"5.0","5.0","Behind a weather-beaten fence, you see the old, unused sugar cane fields. The fields look as if they haven't been planted in years.","מאחורי גדר דהויה, את רואה את שדות קנה הסוכר הישנים הנטושים. נראה כאילו לא שתלו בהם דבר כבר שנים.",""
"5.0","6.0","You see no need to carry around a rose.","את לא רואה צורך בלקחת איתך ורד.",""
"5.0","7.0","The roses smell wonderful in the night air.","הוורדים מריחים נפלא באוויר הלילי.",""
"5.0","8.0","The fence is too difficult to climb. Besides, you don't care about those old fields.","יהיה קשה מדי לטפס על הגדר. חוץ מזה, לא אכפת לך מהשדות הישנים.",""
"5.0","9.0","Even your bulging muscles couldn't move those heavy urns.","אפילו השרירים הבולטים שלך לא יצליחו להזיז את הכדים הכבדים האלה.",""
"5.0","10.0","There is nothing of interest under the urns.","אין שום דבר מעניין מתחת לכדים.",""
"5.0","11.0","The urn is empty.","הכד ריק.",""
"5.0","12.0","The urns are much too heavy to carry around.","הכדים כבדים מדי מכדי לקחת אותם.",""
"5.0","13.0","Upon two marble pedestals sit matching marble urns.","שני כדי שיש תואמים עומדים על זוג בסיסי שיש.",""
"5.0","14.0","There are no trees here to climb.","אין כאן עצים לטפס עליהם.",""
"5.0","15.0","There is nothing but grass under the benches.","אין דבר פרט לדשא מתחת לספסלים.",""
"5.0","16.0","You don't feel like sitting around.","לא מתחשק לך לשבת.",""
"5.0","17.0","There are two garden benches here.","יש כאן שני ספסלי גינה.",""
"6.0","0.0","There is a poor, but clean, shack here at the edge of the old sugar cane fields. Nearby, you see a small chicken coop.","בקתה עלובה, אבל נקייה, שוכנת בקצה שדות קנה הסוכר הישנים. את רואה לול תרנגולות קטן בקרבת מקום.",""
"6.0","1.0","Behind a weather-beaten fence, you see the old, unused sugar cane fields. The fields look as if they haven't been planted in years.","מאחורי גדר דהויה, את רואה את שדות קנה הסוכר הישנים הנטושים. נראה כאילו לא שתלו בהם דבר כבר שנים.",""
"6.0","2.0","An old, weather-beaten fence partitions off the remaining vestiges of the plantation's once-vast sugar cane fields. Now, all that's left are long-ago plowed furrows and old dead stalks.","גדר ישנה ודהויה מחלקת את השרידים הנותרים של מה שהיו פעם שדות קנה הסוכר הנרחבים של האחוזה. כעת כל שנותר הם תלמים שנחרשו מזמן וגבעולים מתים.",""
"6.0","3.0","You don't see a gate here.","את לא רואה כאן שער.",""
"6.0","4.0","The path leads to a small shack.","השביל מוביל לבקתה קטנה.",""
"6.0","5.0","In spite of its poor condition, the shack looks homey enough.","למרות מצבה הרעוע, הבקתה נראית ביתית למדי.",""
"6.0","6.0","You see Celie rocking on her porch on this warm May night.","את רואה את סילי מתנדנדת על המרפסת בלילה החמים של מאי.",""
"6.0","7.0","Celie's old rocking chair waits for her on the little porch.","כיסא הנדנדה הישן של סילי מחכה לה על המרפסת הקטנה.",""
"6.0","8.0","There's no need to do that; she's right here!","אין צורך לעשות את זה; היא כאן!",""
"6.0","9.0","The fence is too difficult to climb. Besides, you don't care about those old fields.","יהיה קשה מדי לטפס על הגדר. חוץ מזה, לא אכפת לך מהשדות הישנים.",""
"6.0","10.0","There is nobody here.","אין כאן אף אחד.",""
"6.0","11.0","""Jest a secon'.""","""רק שנייה.""",""
"6.0","12.0","""Whut you want, Missy?!""","""מה 'ת רוצה, גיברת?!""",""
"6.0","13.0","""I ain't got time fer you right now, Missy. 'Scuse me.""","""אין לי זמן אלייך עכשיו, גיברת. סלחי לי.""",""
"6.0","14.0","""My necklace! I wuz wunderin' where it got to! Well, Missy Laura, why don' you come in an' visit wid me awhile?""","""השרשרת שלי! תהיתי לאן היא נעלמה! טוב, גיברת ליאורה, למה שלא תיכנסי ותבקרי אותי לקצת זמן?""",""
"6.0","15.0","""Nice ta see you agin, Missy Laura. Won'cha come in?""","""טוב לראות 'תך שוב, גיברת ליאורה. רוצה ליכנס?""",""
"6.0","16.0","""What you doin' here, girl?! Can't you feel the evil in the air?! There's somethin' real bad 'round here and I'm stayin' put in mah cabin behind locked doors. You git yourse'f on back to your room, hear?!""","""מה 'ת עושה כאן, ילדה?! אינך מרגישה את הרוע באוויר?! משהו רע מאוד קורה כאן ואני מסתגרת בבקתה ש'לי מאחורי דלתות נעולות. את תזיזי את עצמך בחזרה לחדר, שומעת?!""",""
"6.0","17.0","""Go away!! I'm not unlockin' this here door anymore!""","""לכי מפה!! אני לא פותחת את הדלת הזאת יותר!""",""
"6.0","18.0","""Go 'way!! I ain't openin' this door!""","""ס'תלקי מכאן!! אנ'לא פותחת את הדלת!""",""
"6.0","19.0","""Leave me 'lone!!""","""תעזבי אותי לנפשי!!""",""
"6.0","20.0","""Get 'way from my door!! I ain't comin' near it!""","""עופי לי מהדלת!! אני'לא מתקרבת אליה!""",""
"6.0","21.0","""Please!! Leave me outta this!""","""אנא!! אל תערבי אותי בזה!""",""
"6.0","22.0","""I ain't unlockin' this here door!!""","""אנ'לא פותחת את הדלת!""",""
"6.0","23.0","""Go 'way!!""","""תלכי מכאן!!""",""
"6.0","24.0","You cautiously knock at the door of the old shack but receive no answer.","את נוקשת בזהירות על דלת הבקתה הישנה אך לא זוכה לתשובה.",""
"6.0","25.0","This is not your house!","זה לא הבית שלך!",""
"6.0","26.0","It's just a plain, wooden door.","זו רק דלת עץ פשוטה.",""
"6.0","27.0","It's not nice to enter people's houses without being invited.","לא יפה להיכנס לבתים של אנשים ללא הזמנה.",""
"6.0","28.0","You try opening the door, but discover it's locked.","את מנסה לפתוח את הדלת, אך מגלה שהיא נעולה.",""
"6.0","29.0","You can't get that.","את לא יכולה לקחת את זה.",""
"6.0","30.0","The rocking chair is already occupied!","כיסא הנדנדה כבר תפוס!",""
"6.0","31.0","You don't feel like sitting around.","לא מתחשק לך לשבת.",""
"6.0","32.0","Celie is sitting on her rocking chair enjoying the night air.","סילי יושבת על כיסא הנדנדה שלה, נהנית מהאוויר הלילי.",""
