room,idx,original,translated
8,69,"A closer look at the object on the floor reveals that it is a warp motivator. It looks a bit more high-tech than the other junk strewn about this locale. Sturdily constructed, its only protrusion is a modular plug near its base.",
8,70,The eight-pronged plug protrudes only slightly from the motivator's exterior.,
8,71,The floor is composed of a mosaic of overlapping welded steel plates. The menage of used metal plates appear to have been cut from a variety of sources. There is a small round object lying nearby.,
8,72,"While relatively small, it seems to be quite dense. I think we're looking at a potential hernia if any attempts are made to manually relocate it.",
8,73,You aren't capable of doing that.,
8,74,You can't. It's permanently attached.,
8,75,"It's a cute little thing. You've never seen anything like it in these parts, but then where are these parts? Some writing on its exterior reads `For a good time, don't call HAL!'.",
8,76,"It's a cute little thing. You've never seen anything like it in these parts, but then where are these parts? Some writing on its exterior reads `Bowman was here'.",
9,0,A system consisting of buckets and a conveyer (when running) hauls small pieces of scrap to the east.,
9,1,A system consisting of buckets and a conveyer hauls small pieces of scrap to the east.,
9,2,It's way down there and not very pretty.,
9,3,The only junk visible is the small amounts nestled in the conveyer buckets.,
9,4,You are standing on a narrow rail suspended high above the floor of the freighter. A conveyer system below leads to the right grinder. Be careful - it's a long way down.,
9,5,This conveyer is no place for sight-seeing.,
9,6,You are riding below a narrow rail suspended high above the floor of the freighter. A conveyer belt below leads to a shredder.,
9,7,Right! Get real.,
9,8,You stepped off the rail! You're dead again. Way to go. Haven't we taught you anything?,
9,9,"From your seat you see a handle, (presently being gripped by you) which controls Motion, and a button marked CLAW.",
9,10,You must stop the grabber before claw functions can be executed.,
9,11,That's already being done.,
9,12,It looks like something that would cradle your posterior nicely.,
9,13,That would be unwise.,
10,0,The conveyer belt (now empty) transports small piles of debris to the shredder at the end.,
10,1,Small piles of space junk make their way down the conveyer belt to a shredder.,
10,2,"The debris here is portioned onto the conveyer which enters from the left. The small piles roll along until they interface with the shredder where, true to its name, all is shredded.",
10,3,It's way down there and not very pretty.,
10,4,"The shredder is a mean-looking device. When running, it mercilessly breaks debris down to many smaller pieces of debris.",
10,5,The shredder is a mean-looking device. It mercilessly breaks debris down to many smaller pieces of debris.,
10,6,A number of pipes run through the area. They are of no significance.,
10,7,You are standing on a narrow rail suspended high above the floor of the freighter. A conveyer belt below leads to a grinder. Be careful - it's a long way down.,
10,8,This conveyer is no place for sight-seeing.,
10,9,You are riding below a narrow rail suspended high above the floor of the freighter. A conveyer belt below leads to a shredder.,
10,10,You can't climb that.,
10,11,Right! Get real.,
10,12,Don't push it! You made it up here safely. Quit while you're ahead.,
10,13,Check again.,
10,14,It's not within your reach.,
10,15,"While it might be tactilly stimulating, your cause won't be furthered.",
10,16,That doesn't look like a safe place to jump to.,
10,17,You can't from this position.,
10,18,"Shredded like an Iran-Contra document, your many independent parts flutter to the bottom of the hopper. This is of little importance to you, what with your being dead and all.",
10,19,You stepped off the conveyer. You're dead again. Way to go. Haven't we taught you anything?,
10,20,You stepped off the rail! You're dead again. Way to go. Haven't we taught you anything?,
10,21,"From your seat you see a handle, (presently being gripped by you) which controls motion, and a button marked CLAW.",
10,22,"Due to a series of pipelines directly below you, the claw is programmed not to work here.",
10,23,It looks like something that would cradle your posterior nicely.,
10,24,That would be unwise.,
11,0,You are standing on a narrow rail suspended high above the floor at the far end of the freighter. It's a long way down to the junk piles below.,
11,1,You are riding below a narrow rail suspended high above the floor at the far end of the freighter. It's a long way down to the junk piles below.,
11,2,"It's an impressive piece of machinery. Unfortunately you have no idea what it is. Perhaps it is what emitted that tractor beam that brought you here. Or maybe it's some sort of giant trash masher. Or maybe the artist just thought it would look really cool hanging there. Yea, that's it! At any rate, I wouldn't waste any time trying to mess with it.",
11,3,"Sure, you're a devil-may-care kinda guy. This one, however, is beyond even your athletic aptitude.",
11,4,You step on a part of the track which is extremely narrow and greasy. It obviously wasn't designed for human foot travel. It's a quick drop to the unforgiving surface below.,
11,5,You stepped off the rail! You're dead again. Way to go. Haven't we taught you anything?,
11,6,"From your seat you see a handle, (presently being gripped by you) which controls Motion, and a button marked CLAW.",
11,7,You must stop the grabber before claw functions can be executed.,
11,8,That's already being done.,
11,9,It looks like something that would cradle your posterior nicely.,
11,10,That would be unwise.,
12,0,There is some light coming from passages through the west wall.,
12,1,You are standing on a narrow rail suspended high above the floor of the freighter. It's a long way down to the junk piles below. There are two passages to the west.,
12,2,You are riding below a narrow rail suspended high above the floor of the freighter. It's a long way down to the junk piles below.,
12,3,You stepped off the rail! You're dead again. Way to go. Haven't we taught you anything?,
12,4,"From your seat you see a handle, (presently being gripped by you) which controls Motion, and a button marked CLAW.",
12,5,You must stop the grabber before claw functions can be executed.,
12,6,The claw can't operate here.,
12,7,That's already being done.,
12,8,It looks like something that would cradle your posterior nicely.,
12,9,That would be unwise.,
13,0,It's not a model you've seen before. The droid appears to be dedicated to this work station. It seems harmless enough.,
13,1,It is similar to the one you are currently viewing. The only difference is that you can't read what it says.,
13,2,"Your view of the grabber from here reveals a Forward/Reverse control stick (currently grasped), and a button marked CLAW.",
13,3,A grabber hangs beneath a rail. There is a seat for a driver. There is a claw underneath that looks capable of grabbing things.,
13,4,Your viewing angle doesn't allow that.,
13,5,It's hanging peacefully under the grabber.,
13,6,Your not able to make it out here.,
13,7,You are grasping the control stick in your hand.,
13,8,It looks like your standard directional control.,
13,9,The claw looks very much like something which would bear the name 'claw'. A set of opposing appendages is designed to grip an object by applying pressure from about its circumference in the direction of its center.,
13,10,You seem to be covering all available seat surface area making viewing impossible.,
13,11,It looks like something that would cradle your posterior nicely.,
13,12,On the south side of the room is a chute. A platform extends from its edge.,
13,13,On the south side of the room is a chute which leads to who-knows-where. A platform extends from its edge.,
13,14,The rail is supported by beams hanging from the ceiling. The grabber hangs below it.,
13,15,The walls are made of metal and very strong composite materials commonly used in spacecraft.,
13,16,In this room the rail makes a U-turn. There is a chute at the bottom. In the middle are panels of monitoring devices being tended to by a droid.,
13,17,In this room the rail makes a U-turn. There is a machine here which hangs under the rail. There is a chute at the bottom. In the middle are panels of monitoring devices being tended to by a droid.,
13,18,The safety light on top of the grabber indicates that it is currently in use.,
13,19,There is a safety light on top of the grabber. It is currently dark.,
13,20,More metal decking.,
13,21,"The ceiling looks closer from up here. It looks no more spectacular, however.",
13,22,It apparently isn't designed to process input from you.,
13,23,"You are not equipped to mar this metal moron, nor do you need to.",
13,24,You aren't able to do that.,
13,25,Go there yourself.,
13,26,Think again.,
13,27,Not from here.,
13,28,Just move as you've been moving.,
13,29,You must bring the grabber to a complete stop before doing that.,
13,30,You're not in a satisfactory location for performing that act.,
13,31,You're not on it.,
13,32,"You really bit the beam, Buckwheat. And there's that lack of regard for organics in action again. I guess they never heard of the warning shot concept around here. Anyway, you're dead.",
13,33,You stepped off the rail! You're dead again. Way to go. Haven't we taught you anything?,
13,34,"Plopping into the seat, you grasp the forward/backward control of the grabber.",
13,35,The button is programmed not to work in this area.,
13,36,"We haven't seen footwork like that since Gerald Ford! Unfortunately, your fall causes you to make contact with the non-moving deck below. The resulting impact forces the cancellation of your subscription to life.",
14,0,It's going to take quite awhile at this speed.  You've got time to get up and make a sandwich or wax the car or something.,
14,1,"This speed is great for astral combat, but not for jumping across the galaxy.  This could take forever.",
14,2,With a mighty whump you set the Aluminum Mallard down on the surface of %s.,
14,3,"Well, Roger, ya done good!  You managed to rescue the Two Guys and escape from Pestulon alive.  Looks like this'll be a milk run from here on out.",
14,4,"The ramp is immobilized by the junk it's laying in, so you exit through the hatch instead.",
14,5,Please do not attempt to disembark until the ride has come to a complete stop!,
14,6,"First, you'll need to tear your buttocks away from that pilot's seat.",
14,7,"You don't have a motivator, and there isn't one here.",
14,8,It's already closed.,
14,9,All ship systems are accessed through the pilot's computer.,
14,10,You're already sitting.,
14,11,"Since the two guys are in the passenger seats, you have no choice but to sit in the pilot seat.",
14,12,"The two passenger seats look quite comfortable. However, the pilot seat is where you'd rather plop your butt.",
14,13,You're already standing.,
14,14,Please remain seated while vehicle is in motion.,
14,15,You don't have any.,
14,16,"They're so comfortable, you forget that you're already wearing them.",
14,17,You'll have to stand up for that.,
14,18,"After figuring out which side is the front, you put on the ThermoWeave underwear.  They power up automatically, keeping you comfy at all temperatures.",
14,19,"They're so comfortable, you decide to leave them on.",
14,20,You're not wearing them.,
14,21,You'll need to go sit down first.,
14,22,"Searching around the cushions you find, among variously colored wads of lint, seven buckazoids.",
14,23,You find nothing of value.,
14,24,The hole is already exposed.,
14,25,"The tile is doing a nice job of covering the hole, just leave it alone.",
14,26,"But, you're not done in there.",
14,27,It's all closed up.,
14,28,It seems like everyone ignores you.  You'd think they'd be more grateful.,
14,29,"Your voice echoes thinly off the interior walls.  It gets a little lonely out here, doesn't it?",
14,30,You look into the cavity at the reactor.   It's currently non-functional.,
14,31,You look into the cavity.  The wire is firmly attached to cable ends.,
14,32,You look into the cavity and notice only two cable ends.  Someone has made off with the ship's power supply.,
14,33,It seems to be the tile which covered the hole in the floor.,
14,34,There are many of them organized in the shape of a floor.,
14,35,The floor of the cabin consists mainly of a ramp that is currently shut.  An access panel has been removed to reveal an empty reactor compartment.,
14,36,The floor of the cabin consists mainly of a ramp that is currently shut.,
14,37,The control panel contains a computer screen.  All ship systems are accessed through the pilot's computer.,
14,38,The access panel has been removed to reveal an empty reactor compartment.,
14,39,The access panel is firmly in place.,
14,40,There is no need to look at the computer right now.,
14,41,"The diagnostic computer gives you detailed information about the ship's systems.  However, you'll need to get up to use it.",
14,42,The pilot's computer is dead.,
14,43,It's your basic spaceship interior wall.,
14,44,The Two Guys from Andromeda are a couple of really hip dudes.  You wish you could be like them.,
14,45,"Nobody here but you, Wilco.",
14,46,"Yep, that's a seat cushion alright!",
14,47,"You are sitting in the pilot's seat of this sporty little ship.  In front of you is the control panel, which contains a computer screen.",
14,48,Why not go sit down and take a look.,
14,49,You can just see over the trash piled up against the cockpit window.  Above you is the ceiling of the junk freighter.,
14,50,Gosh!  Isn't it amazing how big a spot those space gnats make when you're traveling at light speed!,
14,51,"Wow, a bunch of stars!  Not exactly a new sight for your space-weary eyes.",
14,52,The happy lights of Monolith Burger entice you to enter.,
14,53,You are currently orbiting Ortega.,
14,54,You are currently orbiting Phleebhut.,
14,55,You are currently orbiting Pestulon.,
14,56,"Outside, the stark surface of Ortega stretches into the distance.  A lava-lovers paradise, to be sure.",
14,57,"Outside, the desert surface of Phleebhut stretches into the distance.  Countless eons of howling winds have carved this dry planet.",
14,58,"Outside, the strange surface of Pestulon stretches into the distance.  Forces beyond your comprehension seem to have shaped this bizarre world.",
14,59,The window is transparent.,
14,60,The pilot seat is covered in fine Vorlian pseudoleather.  Ergonomically designed to be comfortable yet stylish.,
14,61,"Yep, there's a bunch of 'em!",
14,62,You'll have to go into space for that.,
14,63,"Looking up, you see a space docking hatch.",
14,64,Through the window you see the ceiling of the junk frieghter.,
14,65,Through the window you see the sky above.,
14,66,The landing ramp is currently closed.,
14,67,The space docking hatch is currently closed.,
14,68,The button is clearly labeled 'ramp open/close.',
14,69,Whoever ripped out the reactor didn't treat the wires too well.  The short cable's end is torn and frayed.,
14,70,The cables are snug in their compartment.,
14,71,At first you are surprised at how intact the ship's interior is.   Immediately to your right is a panel with a red button.   At midship on the right wall is the ship's main diagnostic computer.  Directly across are two passenger seats.  Ahead of you is the cockpit.,
14,72,Immediately to your right is a panel with a red button.  At midship on the right wall is the ship's main diagnostic computer.   Directly across are two passenger seats.   Ahead of you is the cockpit.,
14,73,You already did that.,
14,74,You can't install it from here.,
14,75,That wouldn't do any good.,
14,76,The reactor is automatic.  Just put it in and forget it!,
14,77,You already have it.,
14,78,"Now that it's in place, you hate to take it out again.",
14,79,There's no reactor here.,
14,80,No seatbelts here.  The original owner opted for the 'no-frills' package.,
14,81,You're not even sitting down!,
14,82,It's already open.,
14,83,"The panel is doing its job nicely, don't mess with it.",
14,84,But you're not finished in there.,
14,85,"Come on, you wouldn't fit in there!",
14,86,"You drop the reactor into the hole, carefully reconnect the cables, and put the tile back in place.",
14,87,"You drop the reactor into the hole. In attempting to reconnect the cables, you find that one is much too short.",
14,88,"You carefully connect the wire between the ship and the reactor, putting the tile back in place once you've finished.",
14,89,You install the wire inside the reactor compartment.,
14,90,A flashing message on your monitor attracts your attention.,
14,91,Your ship hovers between the garbage below and the ceiling above.  This will never do.,
14,92,Once again you try to bring the ship from the rubble. You wonder how many times the ship can take this.,
14,93,"You feel a strong rumbling as the ship strains to loosen itself from the confines of the junk heap accumulated at its base. Finally, it begins to rise.",
14,94,"The ship rises several meters, then stops abruptly. An alarm from the computer attracts your attention.",
14,95,"The ship rises successfully, but collides with the top of the freighter.  The resulting explosion sends a potpourri of flesh and metal fragments careening in all directions.",
14,96,The ship settles back down into the nest of debris.,
15,0,You seem to be in a debris-enclosed hollow. Poking out of the ceiling is the chute which you originally entered through. Some crusty lamps linked by non-UL Approved wire provide additional illumination.,
15,1,You seem to be in a debris-enclosed hollow. Poking out of the ceiling is the chute which you originally entered through. Some crusty lamps linked by non-SQ Approved wire formerly provided additional illumination.,
15,2,The aging lamps add extra light to the area. Over-used wires link them to power.,
15,3,There's something that's in short supply. The only light here is that which manages to filter its way through the dense mesh of metals.,
15,4,Some brittle-looking wire runs from lamp to lamp and then disappears into a hole to the left.,
15,5,They're rats!,
15,6,You can hear something scurrying around above you. (You can't actually see the rats because they're hidden in the shadows.),
15,7,They seem to be attached to a reactor.,
15,8,There is nothing interesting about loose wire ends.,
15,9,They aren't visible here.,
15,10,You peer into the small opening and notice %s.,
15,11,You notice nothing of interest.,
15,12,You can't from here.,
15,13,"You stare at the ceiling which, as usual, is overhead. You see nothing particularly unique about the structure.",
15,14,This wall is the same as the others except that it has a small hole in it.,
15,15,All terrain nearby is chock-full of jagged edges and barbed protrusions. I wouldn't try that here.,
15,16,"The chute juts into the room from high above. It is covered by two large doors. While staring at it, you briefly entertain the thought of trying to climb back up it. You realize that it is firmly sealed and forget about it.",
15,17,It's a low-tech ascent/descent module,
15,18,The floor is composed of a mosaic of overlapping welded steel plates. The menage of used metal appears to have been cut from a variety of sources.,
15,19,The walls consist of compacted refuse. Yuck! There seems to be a small hole in the west one.,
15,20,In one of the piles you notice a severed wing and some empty cowlings of different shapes and sizes. The items were probably being readied for whatever destructive processing is done aboard this heap.,
15,21,The wing has been severed and is now worthless.,
15,22,The empty cowlings now cover nothing but useless junk.,
15,23,There is no ladder near here to climb.,
15,24,OK.,
15,25,You grab the ladder and jam it in your pocket.,
15,26,Ouch!,
15,27,There is no ladder near here to get.,
15,28,They would not be helpful.,
15,29,This stuff has no value to you.,
15,30,You unhook the reactor from the cheap wires and take it with you.,
15,31,You aren't near it.,
15,32,There isn't one here to get.,
15,33,You'll not be successful that way.,
15,34,That won't further your progress.,
15,35,You don't have it.,
15,36,Not from here.,
15,37,The chute is covered by two large doors which you are unable to open.,
15,38,"Fortunately, you come to a relatively soft landing in a pile of debris.",
15,39,"You hear strange growls which send chills through your sleek, yet rugged, frame. What could it be?",
15,40,"Suddenly, two hideous figures rush from the shadows toward you!",
15,41,Oh my! It appears that your being trapped has made you a prime target for rodent ruffians. What a mess!,
16,0,Looks like this bird's in good shape.,
17,0,CURRENT SECTOR:,
17,1,PRESS F6 FOR COCKPIT VIEW,
17,2,%d,
17,3,Those jokers back on Pestulon must have tampered with the lightspeed thingamajig!,
17,4,"With the engines off, the ship falls abruptly to the floor.   The resulting impact is too much for it and you.",
17,5,LEAVE RADAR SYSTEM ON WHILE IN FLIGHT,
18,0,TARGET:,
18,1,The remaining enemy ships have given up and are heading back to the planet.  It looks like you were just too much for 'em.,
18,2,"With your shield depleted, the final hit shreds the side of your ship.  In the sudden vacuum, your body fluids expand beyond the capacity of your tissues.  Your desicated body will drift forever, a grim testament to your blundering stupidity.",
18,3,"Having the correct shield up could have prevented this!   The final shot shreds the side of your ship.  In the sudden vacuum, your body fluids expand beyond the capacity of your tissues.  Your desicated body will drift forever, a grim testament to your blundering stupidity.",
18,4,"When the enemy ship comes from behind, you will automatically begin tracking.
Use the direction keys or mouse to move the target cross-hairs onto the target.
When you are locked on, use the space bar to fire.",
19,0, ,
19,1,,
20,0,A beep is issued by the computer as the screen changes.,
20,1,The shot blasts a new orifice in the side of the junk freighter.,
20,2,The pressure generated by the desire of the ship's atmosphere to escape to the considerably lower pressure of space causes your ship to be spit out like a watermelon seed.,
20,3,"Unfortunately, your inadequately protected ship is struck and subsequently destroyed in the bottle neck of metallic objects striving to pass through the same relatively small opening.",
22,0,"Gosh Rog, we really appreciate you saving us and all.",
22,1,"Yeah, we were really scared.  We didn't know what Pug was gonna do to us.",
22,2,"Hey, uh, don't you think we better get outta here?  Pug's really sore and he probably sent some ships after us.",
23,0,"So, how do you like the game so far?  Was it worth $59.95?",
23,1,"Hey, we're hungry.  We haven't eaten anything but jello for the last few weeks.",
23,2,I hafta go to the bathroom.,
23,3,Can't you make this crate go any faster?,
23,4,"Just between you and me, I think ol' Wilco's been in space too long.",
24,0,Man oh man!  You really showed those bozos a thing or two!  Now can we get something to eat?,
24,1,You inform the Two Guys that light speed is no longer functional.  They're not overly pleased by this piece of news.,
24,2,what!!  Now I'll never get any food!  Some rescuer you are!,
24,3,"Hey, what's this thing on the wall?",
24,4,"it sez...'light speed maintenance access panel.'  gee, maybe i can fix this bucket of plastobolts!",
24,5,"yeah, this is it!  this fan belt thing came off of the round thing it was on.  Just a second.",
24,6,"ok, she's all fixed.  let's go grab a burger!",
24,7,"Too late you realize that you have no course laid in.  The light engines kick in before you can override.  You inform the Two Guys that light speed is now functional, but it's out of control.  They're not overly pleased with this bit of news, either.",
24,8,aaaaaaaahhhh!!!!  we're gonna die!!!!!!,
24,9,oh noooooooo!!!  why did i get up this morning?!!!,
24,10,mommyyyyyyyyy!!!!,
24,11,"Careening blindly through space, your ship speeds toward a sizable black hole.  Once within the gravitation of the black hole, there's no escape.  You plunge into destiny.",
25,0,PRESS F6 TO EXIT,
25,1,You haven't even ordered.,
25,2,"Cash only, please.",
25,3,"The more you look at the food, the less like food it looks.   You can't help wondering how long some of this stuff has been sitting out here just waiting for a sucker like you to come along and eat it.",
25,4,"The ceiling above, the floor below, the physical laws of the universe are unchanging.  Suspended above you is a menu.",
25,5,You think the sign should be titled `Employee With the Most Facial Orifices.',
25,6,The clerk is wearing the crisply starched uniform that you've come to know and love in Monolith Burgers everywhere.  It looks like it's made from the same substance as the food.,
25,7,The clerk is offended that you would think he's a female.  Any idiot should be able to tell the difference.,
25,8,The clerk looks like he'd rather be doing anything besides waiting on you.,
25,9,"The huge, alien eyes seem to exude a vast intelligence.   But, you're not fooled.",
25,10,A dental hygienist's nightmare.,
25,11,"When this guy gets a cold, tissue company stocks rise dramatically.",
25,12,"""I don't have all day, sir,"" he says in a mock-polite tone of voice.",
25,13,"Not being sure what he might do with his many orifices, you decide against it.",
25,14,The only thing you can smell is the aroma of home-cooked food.  Obviously a piped-in smell to mask the odor of the real food.,
25,15,You'll have to go sit down for that.,
25,16,,
25,17,%d,
27,0,The big yellow 'M' welcomes you to another culinary experience at Monolith Burger,
27,1,"Captain's Log: Funny, I thought this was the last frontier, but it seems like there's a fast food joint around the corner from every star cluster.",
