room,idx,original,translated
0,0, Score: %d of %d%13s%s%1s,
0,1, ,
0,2,Memory fragmented.,
0,3,OK.,
0,4,This isn't a text adventure!,
0,5,"OK, you wear the belt.",
0,6,You're already wearing it.,
0,7,"First, you need to wear it.",
0,8,The belt is now completely out of power.,
0,9,"Looking at the belt, you notice that the power supply is very low. You decide to hold off until you really need it.",
0,10,You're already wearing them.,
0,11,"Not a good idea, considering your location.",
0,12,You decide to leave the ring in the relative safety of your pocket.,
0,13,I'll get naked if you get naked. You go first.,
0,14,"On second thought, it looks pretty silly.  Let's not.",
0,15,It's on the end of your pole.,
0,16,"Look out, it's low on power.",
0,17,The terminator's invisibility belt is now completely out of power.,
0,18,You don't have one of those.,
0,19,Forget it. Think of something else.,
0,20,That doesn't seem to be available.,
0,21,You already have it.,
0,22,You smell nothing of note.,
0,23,Keep it to yourself.,
0,24,You can't,
0,25,Not now.,
0,26,Sorry. We don't do running.,
0,27,"Hey, trashmouth! Don't be saying that shit!",
0,28,Hey! What kind of talk is that?,
0,29,%d/%d,
0,30,curRoomNum = %d,
0,31,"Try another word. Apparently, ""%s"" isn't in the Andromedan dictionary.",
0,32,Do me a favor and try rephrasing that thought.,
0,33,Pardon me. This program is too stupid to glean your desire from such a wonderfully crafted sentence. Please try something else.,
0,34,You possess %d of these nifty monetary units known as `Buckazoids'.,
0,35,It's not quite within reach.,
0,36,You've accomplished that task.,
0,37,You see nothing special.,
0,38,That's not possible now.,
0,39,You don't have it.,
1,0,,
1,1,"The pod, considered to be nothing more
than another piece of scrap, is taken
aboard a robot commanded garbage
freighter. Unfortunately these robots
have no regard for organics.",
2,0,Check again! It IS closed.,בדוק שנית! זה סגור.
2,1,This task is impossible since the door is sealed from the inside and there is no light emanating from within.,זאת משימה בלתי אפשרית משום שהדלת נעולה מבפנים ושום אור לא בוקע משם.
2,2,The window is clear enough to reveal the blackness inside.,החלון נקי מספיק בשביל לחשוף את החשיכה שבפנים.
2,3,The solidly built door looks to be locked in place.,הדלת המוצקה למראה נעולה על מנעול ובריח.
2,4,"The pod's thrusters are very small, designed for minimal attitude adjustments. They have been cold for a long time.","מנועי החללית קטנים מאד, מתוכננים לכיוונונים עדינים. נראה שהם כבר התקררו מזמן."
2,5,This is the escape pod which safely whisked you away from Vohaul's burning asteroid fortress. The skin of the pod plainly registers the cumulative damage long periods of space travel can inflict on a small craft such as this.,זהו תרמיל מילוט שנועד לשיגור בטוח ממצודת אסטרואידים בוערת בוואול. הנזקים המצטברים מנסיעות החלל הממושכות הותירו את רישומיהם על גבי מעטפת התרמיל.
2,6,You are standing in a debris-cluttered junk bay. An escape pod rests in the middle of the room. There are chunks of metal lying around which seem to be small sections of old spaceware.,אתה עומד על מסוף גרוטאות עמוס פסולת. תרמיל המילוט נח במרכז החדר. פיסות מתכת פזורות מסביב במה שנראה כמו אגפים קטנים של מחסן חלל ישן.
2,7,The room bears a very metallic fragrance.,החדר אפוף בניחוח מאד מתכתי.
2,8,The door was automatically sealed when the pod shut down shortly after your exit. It has served its purpose and will be of no further use.,הדלת נאטמה אוטומטית בעת שהתרמיל כיבה את עצמו מיד לאחר צאתך. הוא מילא את ייעודו בעולם ולא יהיה בו שימוש בעתיד.
2,9,"Despite technological advances in strong, lightweight ship materials, you can't possibly budge it.","למרות ההתקדמות הטכנולוגית שחלה בפיתוח חומרי חלל חזקים וקלי משקל, אינך יכול פשוט לדחוף את זה."
2,10,It's not available for your use.,הוא לא נועד לשימושך.
2,11,"If YOU could break the glass, it and you would not have survived the journey here.","אם היית יכול לנפץ את הזכוכית, הוא ואתה לא הייתם שורדים את המסע לכאן."
2,12,You are unable to scale it.,אין באפשרותך לטפס על זה.
2,13,You are unable to scale anything here.,אין באפשרותך לטפס על כלום כאן.
2,14,It is locked. You are unable to gain access.,זה נעול. לא תוכל להיכנס.
2,15,"Where Do You What To Start?
(Press ESC to Stay Here)","מהיכן תרצה להתחיל?
(לחץ על מקש ה-ESC על מנת להישאר כאן)"
2,16,"You notice that the sounds from the pod grow softer until they are imperceptible. Having served its purpose and taxed its resources, the pod gives a final hum and shuts down.","הבחנת כי הרעשים מהתרמיל הלכו ודעכו עד כי פסקו לגמרי. לאחר ששירת את מטרתו ומילא את חובתו, התרמיל השמיע את זמזומו האחרון וכבה לעד."
2,17,Sensing an adequate surface the claw releases its cargo and begins the ascent to the grabber unit.,בזהותה משטח הולם הצבת משחררת את מטענה ומתחילה בהעלאה על יחידת הגרירה.
2,18,"The claw senses contact with the warp motivator, grasps it firmly, and begins the ascent back to the grabber.","הצבת חשה במגע עם מניע המוטיבטור, אוחזת בו בחוזקה, ומחדשת את ההעלאה על גבי הגורר."
2,19,"Finding nothing here to carry, the claw begins the ascent to the grabber unit.","כשאינה מוצאת דבר לשאת, הצבת פותחת בהעלאה על גבי יחידת הגרירה."
2,20,"It looks like the warp motivator you saw on the Aluminum Mallard's Status Computer. Sturdily constructed, its only protrusion is a modular plug near its base.","זה נראה כמו מניע המוטיבטור שראית במחשב המצב באלומיניום מלארד. במבנהו החסון, הבליטה היחידה בו היתה שקע מודולרי סמוך לבסיסו."
2,21,"A closer look at the object on the floor reveals that it is a warp motivator. It looks a bit more high-tech than the other junk strewn about this locale. Sturdily constructed, its only protrusion is a modular plug near its base.","מבט מקרוב על העצם המוטל על הקרקע גילה כי זהו מניע המוטיבטור. הוא נראה יותר כמו הייטק מאשר עוד זבל שזרוע כאן באזור. במבנהו החסון, הבליטה היחידה בו היתה שקע מודולרי סמוך לבסיסו."
2,22,The eight-pronged plug protrudes only slightly from the motivator's exterior.,השקע המשונן בלט אך מעט ממעטהו החיצוני של המוטיבטור.
2,23,The floor is composed of a mosaic of overlapping welded steel plates. The menage of used metal plates appear to have been cut from a variety of sources. There is a small round object lying nearby.,הרצפה הורכבה מפסיפס של לוחות פלדה מרותכים. נראה כי שלישיית לוחיות המתכת נחתכו ממגוון מקורות. חפץ עגלגל קטן נח בקרבת מקום.
2,24,You aren't capable of doing that.,אינך מסוגל לעשות זאת.
2,25,"While relatively small, it seems to be quite dense. I think we're looking at a potential hernia if any attempts are made to manually relocate it.","למרות גודלו הזעיר, הוא נראה דחוס למדי. אני חושב שאנחנו מסתכנים בקילה אם ננסה להעבירו למקום אחר בכוחות עצמנו."
2,26,You can't. It's permanently attached.,אתה לא יכול. הוא מחובר בחוזקה.
3,0,"Bending aside a thin piece of scrap, you find an opening into another area and climb on in.",
3,1,This bulbous craft looks like it has seen a lot of action in its day. You believe it to be a bowtie fighter dating back to the cologne wars - a true relic.,
3,2,"This on is another fine, but worthless, Acme product.",
3,3,This ship says Jupiter 2. This baby must have been floating around out there for a long time. It doesn't hold your interest for very long.,
3,4,None are visible.,
3,5,It looks like your standard low-tech ascent/descent unit.,
3,6,It's not visible from here.,
3,7,You can see down into the hole you once passed through. Nothing much can be seen from here.,
3,8,You can't from here.,
3,9,The limited detail you make out through the ship's film-laden viewport is enough to convince you that everything of worth has been harvested.,
3,10,The square object looks like an empty component cover for some craft. It covers nothing but deck now.,
3,11,You see nothing but riveted steel.,
3,12,Various types of abandoned spacecraft litter the floor of this intergalatic junkyard. All this place needs is a junk yard dog. You shiver at the thought.,
3,13,"You can't do that, nor would it be helpful.",
3,14,"Despite technological advances in strong, lightweight ship materials, you can't possibly budge it.",
3,15,You hear the faint sound of machinery in operation.,
3,16,There is no visible means of entry.,
3,17,You are not skilled in ship climbing.,
3,18,It's against your nature to do that.,
3,19,Don't waste your time with that stupid box.,
3,20,OK.,
3,21,You don't have it.,
3,22,Not from here.,
3,23,There is no ladder here to climb.,
3,24,There is nothing to climb into.,
3,25,That would be fruitless. Don't bother.,
3,26,You grab the ladder and jam it in your pocket.,
3,27,Ouch!,
3,28,It's not here to be gotten.,
3,29,There is no ladder here.,
3,30,You ease your way into the hole.,
3,31,"Unfortunately, the fall was too much for your frail frame to withstand.",
3,32,Sensing the floor the claw releases its cargo and begins the ascent to the grabber unit.,
3,33,"The claw senses contact with the warp motivator, grasps it firmly, and begins the ascent back to the grabber.",
3,34,Finding nothing here the claw begins to ascend to the grabber unit.,
3,35,YEOW!,
3,36,"It's obvious that the metal was sharper than you. The resulting laceration turns you into a living fountain - at least for a few moments. Unfortunately for you, this show was your finale. Good luck in the afterlife.",
3,37,"It looks like the warp motivator you saw on the Aluminum Mallard's Status Computer. Sturdily constructed, its only protrusion is a modular plug near its base.",
3,38,"A closer look at the object on the floor reveals that it is a warp motivator. It looks a bit more high-tech than the other junk strewn about this locale. Sturdily constructed, its only protrusion is a modular plug near its base.",
3,39,The eight-pronged plug protrudes only slightly from the motivator's exterior.,
3,40,The floor is composed of a mosaic of overlapping welded steel plates. The menage of used metal plates appear to have been cut from a variety of sources. There is a small round object lying nearby.,
3,41,"While relatively small, it seems to be quite dense. I think we're looking at a potential hernia if any attempts are made to manually relocate it.",
3,42,You aren't capable of doing that.,
3,43,You can't. It's permanently attached.,
3,44,This looks like some type of tunnel boring implement.,
3,45,"This ship is another fine, but worthless, Acme product.",
4,0,Buckets are attached to a conveyer. They haul metal debris to a horizontal conveyer above.,
4,1,You are overwhelmed by the variety of space trash around each corner. A large bucket conveyer carries shredded ships to a horizontal conveyer high above.,
4,2,Somewhere there's an oversized android missing a limb.,
4,3,It says Jupiter 2. This baby must have been floating around out there for a long time. It doesn't hold your interest for very long.,
4,4,"The viewport is too high. Besides, you'd not see anything interesting.",
4,5,None are visible.,
4,6,Hoooo boy! It's a big one.,
4,7,The item in question is just another piece in a fine collection of worthless junk carelessly splashed around the picture by the graphic artist. (You know who you are.),
4,8,You peer up and down the conveyer shaft. The view down is obstructed by the tight fit of the conveyer. The view up show it to lead to a horizontal conveyer above.,
4,9,That's not within your power.,
4,10,"You can't do that, nor would it be helpful.",
4,11,"Looks dangerous but go ahead, you thrill seeker, you. You'll need to get closer though.",
4,12,You are not skilled in ship climbing.,
4,13,"Despite technological advances in strong, lightweight ship materials, you can't possibly budge it.",
4,14,Sounds a little kinky. Maybe you should do that when no one else is around.,
4,15,"The item in question, which is just another piece in a fine collection of worthless junk carelessly splashed around the picture by the graphic artist, isn't needed by you.",
4,16,No.,
4,17,"Yeah, right! That's just what you need.",
4,18,"It looks like the warp motivator you saw on the Aluminum Mallard's Status Computer. Sturdily constructed, its only protrusion is a modular plug near its base.",
4,19,"A closer look at the object on the floor reveals that it is a warp motivator. It looks a bit more high-tech than the other junk strewn about this locale. Sturdily constructed, its only protrusion is a modular plug near its base.",
4,20,The eight-pronged plug protrudes only slightly from the motivator's exterior.,
4,21,The floor is composed of a mosaic of overlapping welded steel plates. The menage of used metal plates appear to have been cut from a variety of sources. There is a small round object lying nearby.,
4,22,You can't. It's permanently attached.,
4,23,"While relatively small, it seems to be quite dense. I think we're looking at a potential hernia if any attempts are made to manually relocate it.",
4,24,You aren't capable of doing that.,
4,25,"Sensing the floor, the claw releases its cargo and begins the ascent to the grabber unit.",
4,26,"The claw senses contact with the warp motivator, grasps it firmly, and begins the ascent back to the grabber.",
4,27,"Finding nothing here, the claw begins to ascend to the grabber unit.",
5,0,"It's quite dark in there, but there is a light at the end of the tunnel.",
5,1,"Not much remains. If there was anything of value, it was stripped away a long time ago.",
5,2,"It looks to be another metallic menace whose time has come and gone. Hopefully, fate will be kinder to you.",
5,3,Its metallic parts are frozen in place. I'll bet you're glad you weren't around when it was functional.,
5,4,You are quite impressed by the size of this junk freighter. The skeletal remains of a stripped-down space tanker stage lie half buried in scrap.,
5,5,It falls on non-existent ears.,
5,6,The gutted ship is unsafe for any such action.,
5,7,You don't fit,
5,8,You can't.,
5,9,Let the poor thing rest in peace. It can't help you anyway.,
5,10,"It looks like the warp motivator you saw on the Aluminum Mallard's Status Computer. Sturdily constructed, its only protrusion is a modular plug near its base.",
5,11,"A closer look at the object on the floor reveals that it is a warp motivator. It looks a bit more high-tech than the other junk strewn about this locale. Sturdily constructed, its only protrusion is a modular plug near its base.",
5,12,The eight-pronged plug protrudes only slightly from the motivator's exterior.,
5,13,The floor is composed of a mosaic of overlapping welded steel plates. The menage of used metal plates appear to have been cut from a variety of sources. There is a small round object lying nearby.,
5,14,"While relatively small, it seems to be quite dense. I think we're looking at a potential hernia if any attempts are made to manually relocate it.",
5,15,You aren't capable of doing that.,
5,16,You can't. It's permanently attached.,
5,17,Sensing the floor the claw releases its cargo and begins the ascent to the grabber unit.,
5,18,"The claw senses contact with the warp motivator, grasps it firmly, and begins the ascent back to the grabber.",
5,19,Finding nothing here the claw begins to ascend to the grabber unit.,
6,0,You see another boring ceiling.,
6,1,The walls are made of metal. Missing panels reveal old frayed wires.,
6,2,One panel lies wedged against the wall. The other remaining panels are welded in place and are quite uninteresting in appearance.,
6,3,It's against the wall covering only more wall.,
6,4,You see another boring floor.,
6,5,Someone (or someTHING) has done a real job on this tanker. Was this the result of some space battle? Or perhaps you're not the only one roaming around in here.,
6,6,It looks to have survived better than its co-conductors.,
6,7,"Except for the one on the left, most of the wires here look dangerously worn.",
6,8,All the wires here look dangerously worn.,
6,9,You see nothing but darkness.,
6,10,"You only are able to see gray, furry blur. It looks like a rat.",
6,11,The fur-bearing pocket prober isn't currently present.,
6,12,Funny. I don't see that in this picture.,
6,13,You don't notice a hole.,
6,14,"The pipes are useless, as they are punctured in many places.",
6,15,There is nowhere for you to climb to.,
6,16,There are no decent wires within reach.,
6,17,There is no other wire here worthy of your acquisition.,
6,18,They're useless.,
6,19,You can't.,
6,20,The panel is of no use.,
6,21,You take the only decent piece of wire available.,
6,22,You seem to have been mugged by some type of large rat. As you pick loose fur from your teeth you notice a less bulky feeling.,
7,0,The gutted carcass of the tanker opens up to reveal even more junk. A metal head rests nearby.,
7,1,"It's quite dark in there, but there is a light at the end of the tunnel.",
7,2,"Not much remains. If there was anything of value, it was stripped away a long time ago.",
7,3,Wow! An ancient model of a Battlebot. I bet you'd hate to run into whatever brought this big guy down. It looks like something poked it in the eye.,
7,4,There are two eyes on the battlebot head. One of them has been broken.,
7,5,You can't see anything from down here.,
7,6,They're just small air ducts for the robot.,
7,7,The pyramid is nothing more than a dense metallic protrusion.,
7,8,The floor is composed of a mosaic of overlapping welded steel plates. The menage of used metal appears to have been cut from a variety of sources. The floor drops off near the large robot.,
7,9,The piles of scrap drop off here. It looks dark and dangerous down there.,
7,10,It isn't a ship. It's an ancient model of a Battlebot. I bet you'd hate to run into whatever brought this big guy down. It looks like something poked it in the eye.,
7,11,You can't from this location.,
7,12,"You're intellectual profile may be slim, but you still are too thick to enter that.",
7,13,"Whatever you say, Superman.",
7,14,Get closer.,
7,15,I don't think you're man enough!,
7,16,Sounds like you want to be doing something besides playing a dumb game.,
7,17,"You don't need to do that. Besides, one of them is already broken.",
7,18,"Oh, gosh! You've stepped off a metallic escarpment and tumbled into the darkness. Twisted, jagged remnants of old vehicles reach out to slow your dark descent, cutting short your life in the process.",
7,19,"It looks like the warp motivator you saw on the Aluminum Mallard's Status Computer. Sturdily constructed, its only protrusion is a modular plug near its base.",
7,20,"A closer look at the object on the floor reveals that it is a warp motivator. It looks a bit more high-tech than the other junk strewn about this locale. Sturdily constructed, its only protrusion is a modular plug near its base.",
7,21,The eight-pronged plug protrudes only slightly from the motivator's exterior.,
7,22,The floor is composed of a mosaic of overlapping welded steel plates. The menage of used metal appears to have been cut from a variety of sources. There is a small round object lying nearby.,
7,23,"While relatively small, it seems to be quite dense. I think we're looking at a potential hernia if any attempts are made to manually relocate it.",
7,24,You aren't capable of doing that.,
7,25,You can't. It's permanently attached.,
7,26,Sensing the floor the claw releases its cargo and begins the ascent to the grabber unit.,
7,27,"The claw senses contact with the warp motivator, grasps it firmly, and begins the ascent back to the grabber.",
7,28,Finding nothing here the claw begins to ascend to the grabber unit.,
8,0,"All of the metal has very jagged edges but is, otherwise, fairly ordinary.",
8,1,It looks like your basic hatch handle.,
8,2,You can't do that from down here.,
8,3,"It's a cute little thing. You've never seen anything like it in these parts, but then where are these parts? Some writing on its exterior reads `For a good time, don't call HAL!'",
8,4,"It's a cute little thing. You've never seen anything like it in these parts, but then where are these parts? Some writing on its exterior reads `Bowman was here.'",
8,5,It's a sleek-looking number if you can disregard the junk it's rooted in. It must be a recent addition to the collection as everything seems to be intact. Etched on each side is the name `ALUMINUM MALLARD'. On top is a small hatch.,
8,6,None are visible.,
8,7,You can't see them as they are buried in junk.,
8,8,You notice only the segmented spine-like neck of a former galactic menace.,
8,9,The hole in the pod is so small that you are unable to discern any interior features.,
8,10,You are at an unsuitable location for sucessfully viewing that.,
8,11,The blackness of the pod's interior is broken only by a small quantity of light pouring through a tiny meteoroid hole.,
8,12,You can make out a pilot's seat and a console. The aft end is dark.,
8,13,The angle makes it impossible to see any detail.,
8,14,You can't see anything like that from here.,
8,15,You peer into the compartment and see the ship's motivator unit resting snugly in its perch.,
8,16,You peer into the cavity in the top of the ship. The only noteworthy item is a modular plug in the bottom of the opening.,
8,17,You can't see it from here.,
8,18,You can't. It's covered by the warp motivator.,
8,19,It's the modular eight pin variety.,
8,20,You can't see it from down here.,
8,21,"They look like remnants of an orbital space station, or perhaps some type of toys for an over-sized child.",
8,22,It's a low-tech ascent/descent module.,
8,23,It looks like the small round passage that it is.,
8,24,There are none of those here.,
8,25,There is nothing interesting about them.,
8,26,You find yourself at the bottom of another trash pit. An interesting array of alien artifacts is strewn from one end to the other. A large ship is in the middle and a small one is off to one side.,
8,27,Get serious. We've got a game to play.,
8,28,"Despite technological advances in strong, lightweight ship materials, you can't possibly budge it.",
8,29,You can't. It's part of the ship.,
8,30,"Forget it. They're buried too deeply. Besides, you're too old to be playing with toys - at least you should be!",
8,31,You grab the ladder and jam it in your pocket.,
8,32,Ouch! (again),
8,33,You don't need it up here.,
8,34,That's not here to be gotten.,
8,35,Be more specific.,
8,36,I told you not to do that.,
8,37,It's too small for you.,
8,38,That won't help.,
8,39,That can't be done.,
8,40,Nothing is done with that here.,
8,41,That isn't necessary.,
8,42,Check again.,
8,43,You're wasting your time messing with this relic.,
8,44,It won't work here.,
8,45,You don't have that.,
8,46,That would be fruitless. Don't bother.,
8,47,You can't. It's closed permanently.,
8,48,I don't think there is much of you that could fit into the seriously snug aperture.,
8,49,Not with it down there.,
8,50,There is no ladder close enough to climb.,
8,51,There doesn't seem to be a ladder ready for scaling.,
8,52,That would be great. If only someone had been smart enough to bring a ladder.,
8,53,There is no good way to scale the slick ship.,
8,54,You're not in a good location for climbing that.,
8,55,That's not possible.,
8,56,The ship is too slick. You seem to remember an ectomorphic programmer friend telling you about ships with non-stick coatings for greater debris collision tolerance.,
8,57,"You can't do that, nor would it be helpful.",
8,58,We warned you to be careful. Did you listen? Nooooo! Good luck next time.,
8,59,You got lucky this time.,
8,60,YEOW!,
8,61,"It's obvious that the metal was sharper than you. The resulting laceration turns you into a living fountain - at least for a few moments. Unfortunately for you, this show was your finale. Good luck in the afterlife.",
8,62,"You move into position and, grabbing the dull finish of the hatch's handle, commence to open and enter the ship.",
8,63,You notice it to be slick up here. Be careful.,
8,64,"Sensing an adequate surface, the claw releases its cargo and begins the ascent to the grabber unit. The object thuds into place within the cavity of the ship.",
8,65,"Sensing the floor, the claw releases its cargo and begins the ascent to the grabber unit.",
8,66,"The claw senses contact with the warp motivator, grasps it firmly, and begins the ascent back to the grabber.",
8,67,"Finding nothing here, the claw begins to ascend to the grabber unit.",
8,68,"It looks like the warp motivator you saw on the Aluminum Mallard's Status Computer. Sturdily constructed, its only protrusion is a modular plug near its base.",
