file-noun-verb-condition-sequence-,file,noun,verb,condition,sequence,talker,padding,text,translation,comment_padding,comment_text
200.msg-4-1-0-1-,200.msg,4,1,0,1,99,00000001,Droole mans the nav and weapons systems on the Eureka.,דרול מאייש את מערכות הנשק והניווט של היוריקה.,,
200.msg-4-2-0-1-,200.msg,4,2,0,1,99,00000001,Try that from the command chair.,נסה את זה מכסא הפיקוד.,,
200.msg-5-24-0-1-,200.msg,5,24,0,1,99,00000001,Why don't you try that from the command chair.,למה שלא תנסה את זה מכסא הפיקוד.,,
200.msg-5-1-0-1-,200.msg,5,1,0,1,99,00000001,Flo is the Eureka's communications officer.,פלו היא קצינת הקשר ביוריקה.,,
200.msg-5-2-0-1-,200.msg,5,2,0,1,99,00000001,Why don't you try that from the command chair.,מדוע שלא תנסה את זה מכסא הפיקוד.,,
200.msg-6-1-0-1-,200.msg,6,1,0,1,99,00000001,Beyond these doors lies the guts of the Eureka's engineering section.,מאחורי דלתות אלה שוכנים הקרביים של אגף ההנדסה של היוריקה.,,
200.msg-7-0-0-1-,200.msg,7,0,0,1,19,00000000,"It was the chair, really!","זה היה הכיסא, בהן צדקי!",,
200.msg-7-0-0-2-,200.msg,7,0,0,2,21,00000001,"Looks like we got a live one here, Flo.","נראה שדגנו אחד חי, פלו.",,
200.msg-7-0-0-3-,200.msg,7,0,0,3,22,00000001,"You said it, Droole!","אתה אמרת, דרול!",,
200.msg-8-0-0-1-,200.msg,8,0,0,1,21,00000001,"Hello sir, I'm Subcorporal Droole, your nav and weapons officer on this heap.","שלום המפקד, אני תת רב-טוראי דרול, קצין הנשק והניווט שלך על הגרוטאה הזאת.",,
200.msg-8-0-0-2-,200.msg,8,0,0,2,22,00000001,Flo's the name. I'm your com specialist--grade 4.,פלו זה השם. אני מומחית התקשורת שלך--דרג ד'.,,
200.msg-8-0-0-3-,200.msg,8,0,0,3,19,00000001,"Hello crew, I'm your new commanding officer, Captain Roger Wilco.","אהלן צוות, אני הקצין הממונה החדש שלכם, קפטן רוג'ר ווילקו.",,
200.msg-8-0-0-4-,200.msg,8,0,0,4,19,00000001,"I know some of you may not be as excited to be serving on the Eureka as I am, but I promise you this: We are going to be the |c5|BEST|c| gosh darn garbage scow in the entire Star Confederation!","אני יודע שחלקכם אולי פחות מתרגשים לשרת על היוריקה ממני, אבל דבר אחד אני יכול להבטיח לכם: אנחנו הולכים להיות מכולת האשפה המחורבנת |c5|הטובה ביותר |c| בצבר-כוכבא כולו!",,
200.msg-8-0-0-5-,200.msg,8,0,0,5,19,00000001,"We have nothing to fear but fear itself, so hold your heads high men. We shall overcome!","אין לנו ממה לפחד חוץ מהפחד עצמו, אז תזקפו את הראש למעלה אנשים. אנו נתגבר על הכל!",,
200.msg-8-0-0-6-,200.msg,8,0,0,6,19,00000001,"All we are is dust in the wind: born free, running wild, with liberty and justice for all! So let's be all we can be. Remember, it's not just a job: it's an adventure!","איננו אלא עפר ברוח: לחופש נולדנו, בחוץ התרוצצנו, ובליבנו שרנו חירות וצדק לכל! אז בוא נראה להם מי אנחנו. זכרו, זו לא רק עבודה: זו הרפתקה!",,
200.msg-9-0-0-1-,200.msg,9,0,0,1,19,00000001,"Well, she's not going to get me without a fight!","ובכן, היא לא הולכת לתפוס אותי ללא מאבק!",,
200.msg-9-0-0-2-,200.msg,9,0,0,2,21,00000001,"Whatever you say, sir. Been nice knowin' ya!","מה שתגיד, המפקד. היה נעים להכיר אותך!",,
200.msg-10-1-0-1-,200.msg,10,1,0,1,99,00000001,"This automated computer console controls critical functions of the Eureka. But what precisely these functions are, you haven't a clue.","מסוף המחשב האוטומטי שולט על תפקודיה החיוניים של היוריקה. אבל מהם בדיוק אותם תפקודים, אין לך מושג.",,
200.msg-11-1-0-1-,200.msg,11,1,0,1,99,00000001,Auxiliary smoke detector.,גלאי עשן משני.,,
200.msg-12-1-0-1-,200.msg,12,1,0,1,99,00000001,This is the nav/weapons station for the Eureka.,זוהי תחנת הנשק/ניווט של היוריקה.,,
200.msg-13-1-0-1-,200.msg,13,1,0,1,99,00000001,An inaudible subsonic hum emanates from the machinery on the ceiling of the bridge.,זמזום תת-קולי לא ברור בוקע מהמכשור בתקרת הגשר.,,
200.msg-16-1-0-1-,200.msg,16,1,0,1,99,00000001,"If the bridge is the nerve center for a ship and the captain it's brain, well then perhaps the Eureka could use a brain transplant.","אם הגשר הוא מרכז העצבים של הספינה והקפטן הוא המוח שלה, אז במקרה של יוריקה כדאי לשקול השתלת מוח דחופה.",,
200.msg-14-1-0-1-,200.msg,14,1,0,1,99,0a010001,,,,
200.msg-15-1-0-1-,200.msg,15,1,0,1,99,00000001,Smoke detector.,גלאי עשן.,,
201.msg-1-0-1-1-,201.msg,1,0,1,1,22,00000001,Are you kidding! NOW?! What in the Pleiades for?,אתה צוחק! עכשיו?! למה בשם כל הפליאדות?,,
201.msg-1-0-2-1-,201.msg,1,0,2,1,22,00000001,"You don't have to tell me twice, I'm outta here!","אתה לא צריך להגיד לי פעמיים, אני נטשתי!",,
201.msg-2-0-3-1-,201.msg,2,0,3,1,21,00000001,"There's no waste in range of the Refuse Recovery System, Captain.","אין אשפה בטווח מערכת מיחזור הפסולת, קפטן.",,
201.msg-2-0-3-2-,201.msg,2,0,3,2,21,00000001,"That would serve no useful purpose at this time, sir.","זה לא ישרת שום תכלית שימושית בשלב זה, המפקד.",,
201.msg-2-0-3-3-,201.msg,2,0,3,3,21,00000001,"Negative, sir. We are not in refuse recovery range.","שלילי, המפקד. אנחנו לא בטווח מיחזור פסולת.",,
201.msg-2-0-4-1-,201.msg,2,0,4,1,21,00000001,"There's no garbage in range of the RRS, Captain. Unless you count the Eureka itself.","אין אשפה בטווח הממ""פ, קפטן. אלא אם כן אתה מחשיב את היוריקה בעצמה.",,
201.msg-2-0-4-2-,201.msg,2,0,4,2,21,00000001,Yeah. Right.,כן. נכון.,,
201.msg-2-0-4-3-,201.msg,2,0,4,3,21,00000001,I'll give that thought all the consideration it deserves.,אני אתן למחשבה הזאת את כל שיקול הדעת הראוי.,,
201.msg-3-0-5-1-,201.msg,3,0,5,1,24,00000001,"Yes, Captain Wilco.","כן, קפטן ווילקו.",,
201.msg-3-0-5-2-,201.msg,3,0,5,2,24,00000001,"Yes, sir.","כן, המפקד.",,
201.msg-3-0-5-3-,201.msg,3,0,5,3,24,00000001,"Affirmative, I am complying.","חיובי, אני נענה לבקשה.",,
201.msg-4-0-3-1-,201.msg,4,0,3,1,22,00000001,"Yes, sir.","כן, המפקד.",,
201.msg-4-0-3-2-,201.msg,4,0,3,2,22,00000001,"Yes, Captain.","כן, קפטן.",,
201.msg-4-0-3-3-,201.msg,4,0,3,3,22,00000001,"Roger wilco. Oh, excuse me sir, no offense...","רוג'ר ווילקו. אה, סלח לי המפקד, בלי להעליב...",,
201.msg-4-0-4-1-,201.msg,4,0,4,1,22,00000001,"Make up your mind, gumby.","תחליט כבר, הוד מעלתו.",,
201.msg-4-0-4-2-,201.msg,4,0,4,2,22,00000001,Hmmph.,הממף.,,
201.msg-4-0-4-3-,201.msg,4,0,4,3,22,00000001,Get a grip--sir.,תתאפס על עצמך--המפקד.,,
201.msg-5-1-0-1-,201.msg,5,1,0,1,99,00000001,The Captain's chair provides a commanding view of the bridge.,כיסא הקפטן מספק תצוגה פיקודית של הגשר.,,
201.msg-6-0-6-1-,201.msg,6,0,6,1,23,00000001,"Captain, I'm sorry--but the ambassador is dead.","קפטן, אני מצטער--אבל השגרירה מתה.",,
201.msg-6-0-7-1-,201.msg,6,0,7,1,23,00000001,"Captain, the ambassador died from plot complications. We were unable to find a cure for the mutations in time.","קפטן, השגרירה מתה מהסתבכות עלילתית. לא הצלחנו למצוא תרופה למוטציה בזמן.",,
201.msg-6-0-8-1-,201.msg,6,0,8,1,23,00000001,You rang?,צלצלת?,,
201.msg-6-0-8-2-,201.msg,6,0,8,2,23,00000001,"Yes, Cap'n.","כן, קפטן.",,
201.msg-6-1-0-1-,201.msg,6,1,0,1,99,00000001,"It's Cliffy, your chief engineer.","אני צוקי, המהנדס הראשי שלך.",,
201.msg-7-0-3-1-,201.msg,7,0,3,1,23,00000001,"We don't have a cloaking device, Cap'n.","אין לנו מתקן הסוואה, קפטן.",,
201.msg-7-0-3-2-,201.msg,7,0,3,2,23,00000001,"The Eureka isn't outfitted with a cloaking device, sir.","היוריקה לא הצטיידה במתקן הסוואה, המפקד.",,
201.msg-7-0-3-3-,201.msg,7,0,3,3,23,00000001,"Unable to comply Captain, the Eureka doesn't have a cloaking device.","אין אפשרות קפטן, היוריקה לא מצויידת במתקן הסוואה.",,
201.msg-7-0-4-1-,201.msg,7,0,4,1,23,00000001,"Ha, that's a laugh. What do you want me to do, go out the airlock and paint her black?!","חה, בדיחה עלובה. מה אתה רוצה שאעשה, שאצא למנעל האוויר ואצבע אותה בשחור?!",,
201.msg-7-0-4-2-,201.msg,7,0,4,2,23,00000001,"We don't |f8|have|f| a cloaking device, sir.","אין לנו מתקן הסוואה, קפטן.",,
201.msg-7-0-4-3-,201.msg,7,0,4,3,23,00000001,Not bloody likely.,אין שום סיכוי.,,
201.msg-7-0-9-1-,201.msg,7,0,9,1,23,00000001,"We're already cloaked, Captain.","אנחנו כבר מוסווים, קפטן.",,
201.msg-7-0-10-1-,201.msg,7,0,10,1,23,00000001,"Sorry sir, I haven't finished hooking it up yet.","מצטער המפקד, עדיין לא סיימתי לחבר את זה.",,
201.msg-7-0-45-1-,201.msg,7,0,45,1,23,00000001,"We can't cloak the ship while we're at lite speed, sir.","אי אפשר להסוות את הספינה כשהיא טסה במהירות האור, המפקד.",,
201.msg-8-0-3-1-,201.msg,8,0,3,1,23,00000001,"All systems normal, sir.","כל המערכות תקינות, המפקד.",,
201.msg-8-0-3-2-,201.msg,8,0,3,2,23,00000001,"All systems operating within established parameters, Captain.","כל המערכות תקינות בטווח הפרמטרים המוגדרים, קפטן.",,
201.msg-8-0-3-3-,201.msg,8,0,3,3,23,00000001,"Everything's a-ok, sir.","הכל בסדר, המפקד.",,
201.msg-8-0-4-1-,201.msg,8,0,4,1,23,00000001,All systems operational.,כל המערכות תקינות.,,
201.msg-8-0-4-2-,201.msg,8,0,4,2,23,00000001,Everything checks out.,הכל נבדק.,,
201.msg-8-0-4-3-,201.msg,8,0,4,3,23,00000001,The ship is running fine at the moment.,הספינה פועלת כשורה נכון לעכשיו.,,
201.msg-8-0-5-1-,201.msg,8,0,5,1,23,00000001,I've finished putting WD40 back together and reprogrammed her to perform as our science officer. You can now reach her through the science station on your com panel.,סיימתי להרכיב את ה-WD40 מחדש ולתכנת אותה לתפקד כמו קצינת מדע. אתה יכול ליצור איתה קשר באמצעות תחנת המדע בלוח התקשורת שלך.,,
201.msg-8-0-11-1-,201.msg,8,0,11,1,23,00000001,"We're in bad shape, Captain. I don't think we can hold together much longer.","אנחנו במצב לא טוב, קפטן. אני לא חושב שנשרוד עוד הרבה זמן.",,
201.msg-8-0-12-1-,201.msg,8,0,12,1,23,00000001,Captain! That acid-squirting critter of yours is loose down here!,קפטן! היצור משפריץ החומצה שלך מסתובב פה חופשי!,,
201.msg-8-0-12-2-,201.msg,8,0,12,2,23,00000001,And I'm tired of fixing these dang holes in the floor!,ונמאס לי לתקן את החורים הארורים האלה ברצפה!,,
201.msg-8-0-13-1-,201.msg,8,0,13,1,23,00000001,"Main energizers off line, Cap'n. Weapon systems are knocked out too. We're a sitting duck!","מנוע מרכזי כבוי, קפטן. מערכות הנשק גם הן נפגעו אנושות. אנחנו מטרה נייחת!",,
201.msg-8-0-55-1-,201.msg,8,0,55,1,23,00000001,"The cloaking device is working perfectly Captain. There's no way the Goliath can detect us. Unless of course, you go and do something stupid like order me to decloak!","מתקן ההסוואה עובד בצורה מושלמת קפטן. אין סיכוי שהגוליית תצליח לאתר אותנו. אלא אם כן כמובן, תעשה משהו טיפשי כמו לצוות עלי לבטל את ההסוואה!",,
201.msg-9-1-0-1-,201.msg,9,1,0,1,99,00000001,This console controls the Eureka's navigation and weapons functions.,המסוף הזה אחראי על תפעול הנשק והניווט ביוריקה.,,
201.msg-10-0-3-1-,201.msg,10,0,3,1,23,00000001,"We aren't cloaked, Captain Wilco.","אנחנו לא מוסווים, קפטן ווילקו.",,
201.msg-10-0-3-2-,201.msg,10,0,3,2,23,00000001,"That isn't necessary, sir. We're uncloaked.","זה לא הכרחי, המפקד. אנחנו חשופים.",,
201.msg-10-0-3-3-,201.msg,10,0,3,3,23,00000001,"The Eureka is not presently cloaked, sir.","היוריקה אינה מוסווית כרגע, המפקד.",,
201.msg-10-0-4-1-,201.msg,10,0,4,1,23,00000001,That's probably the second dumbest thing I've ever heard in my life.,זה כנראה הדבר כמעט הכי טפשי ששמעתי בחיי.,,
201.msg-10-0-4-2-,201.msg,10,0,4,2,23,00000001,"I think your shirt collar is too tight, sir. The blood isn't making it up to your brain.","נדמה לי שהצווארון שלך הדוק מדי, המפקד. הדם לא עולה לך למוח.",,
201.msg-10-0-4-3-,201.msg,10,0,4,3,23,00000001,Were you born stupid or have you perfected the trait through a lifetime of practice?,האם נולדת טיפש או ששכללת את התכונה הזו בשנים של אימונים מפרכים?,,
201.msg-11-0-14-1-,201.msg,11,0,14,1,21,00000001,"We're approaching our destination, Captain.","אנחנו מתקרבים ליעד, קפטן.",,
201.msg-11-0-14-2-,201.msg,11,0,14,2,21,00000001,Captain Wilco! We're approaching our destination.,קפטן ווילקו! אנחנו מתקרבים ליעד.,,
201.msg-11-0-14-3-,201.msg,11,0,14,3,21,00000001,"Pull your head out Captain, we just missed our destination. Now we're gonna have to lay in a course again!","תתעורר מהחלום קפטן, זה עתה פספסנו את מחוז חפצנו. כעת עלינו לקבוע את המסלול מחדש!",,
201.msg-11-0-14-4-,201.msg,11,0,14,4,21,00000001,"Here we are Captain, nowhere!","הגענו קפטן, לשום מקום!",,
201.msg-11-0-14-5-,201.msg,11,0,14,5,99,00000001,"Captain Wilco, please report to the bridge.","קפטן ווילקו, נא דווח לגשר.",,
201.msg-11-0-15-1-,201.msg,11,0,15,1,21,00000001,"The Goliath's hull is nearing structural failure, Captain. She's going to implode if we don't do something. ","מעטפת הגוליית מתקרבת לכשל מבני, קפטן. היא עומדת לקרוס בכל רגע אם לא נעשה דבר.",,
201.msg-11-0-16-1-,201.msg,11,0,16,1,21,00000001,"We've got the blob aboard, sir. Containment fields are holding at 200 percent capacity--but they won't last long.","יש לנו את הגוש על הסיפון, המפקד. שדות הריתוק עובדים בתפוקה של 200 אחוז--אולם הם לא יחזיקו מעמד לאורך זמן.",,
201.msg-11-0-16-2-,201.msg,11,0,16,2,21,00000001,"We're losing power, sir. The ship's going to fall apart any minute!","אנחנו מאבדים כוח, המפקד. הספינה עומדת להתפרק בכל רגע!",,
201.msg-11-0-17-1-,201.msg,11,0,17,1,21,00000001,"Boy, we're sure having some fun now, eh cap'n? ","בחיי, אין ספק שאנחנו עושים חיים משוגעים, אה קפטן?",,
201.msg-11-0-17-2-,201.msg,11,0,17,2,21,00000001,"We'll all be old fogies by the time we reach our destination at this speed, Captain. ","כולנו נהיה זקנים באים בימים עד שנגיע ליעד במהירות הזאת, קפטן.",,
201.msg-11-0-17-3-,201.msg,11,0,17,3,21,00000001,Don't you think we'd get there a little sooner if we used lite speed you moron--I mean ''sir.'' ,"אתה לא חושב שהיינו מגיעים לשם טיפה יותר מוקדם אילו היינו נוסעים במהירות האור חתיכת אידיוט--כלומר ""המפקד""?",,
201.msg-11-0-41-1-,201.msg,11,0,41,1,21,00000001,"Coordinates locked in, sir. Ready to get underway!","נקודות ציון הוקלדו במערכת, המפקד. מוכנים לצאת לדרך!",,
201.msg-11-0-41-2-,201.msg,11,0,41,2,21,00000001,"Coordinates locked in, Captain. ","נקודות ציון הוקלדו במערכת, קפטן.",,
201.msg-11-1-0-1-,201.msg,11,1,0,1,99,00000001,"This is Droole, your navigation and weapons officer. ","זה דרול, קצין הנשק והניווט שלך.",,
201.msg-12-0-3-1-,201.msg,12,0,3,1,21,00000001,Nav systems on line. Weapons systems nominal.,מערכות ניווט פועלות. מערכות נשק תקינות.,,
201.msg-12-0-3-2-,201.msg,12,0,3,2,21,00000001,"Ready to rock and roll, sir.","מוכן לפעולה, המפקד.",,
201.msg-12-0-3-3-,201.msg,12,0,3,3,21,00000001,"Kick the tires and light the fires, we're all set Captain.","בעט בצמיגים והצת האורים, אנחנו מוכנים קפטן.",,
201.msg-12-0-4-1-,201.msg,12,0,4,1,21,00000001,"Everything's fine, sir. Just peachy.","הכל תותים, המפקד. פשוט דבש.",,
201.msg-12-0-4-2-,201.msg,12,0,4,2,21,00000001,"|f3|OMIGOSH! SHE'S GOING TO BLOW! SHE'S GOING TO BLOW!|f|

 Just kidding, sir.","אוי לא! היא הולכת להתפוצץ! היא הולכת להתפוצץ!
סתם צחקתי, המפקד.",,
201.msg-12-0-4-3-,201.msg,12,0,4,3,21,00000001,"The ship's running fine, sir.","הספינה פועלת כשורה, המפקד.",,
201.msg-12-0-11-1-,201.msg,12,0,11,1,21,00000001,"Weapons inoperative, shields depleted. Basically, we're screwed.","נשקים יצאו מכלל שימוש, מגנים נוטרלו. בקיצור, נדפקנו.",,
201.msg-12-0-15-1-,201.msg,12,0,15,1,21,00000001,"The Goliath is taking quite a beating, sir. If she blows when we're this close, the Eureka will go up with her.","הגוליית ספגה מכה קשה, המפקד. אם היא תתפוצץ כשאנחנו כל כך קרובים, היוריקה תעלה איתה השמימה.",,
201.msg-12-0-16-1-,201.msg,12,0,16,1,21,00000001,"The ship's holding together, sir, but just barely. Something's gonna give before long!","הספינה מחזיקה מעמד, המפקד, אבל ממש בקושי. משהו עומד להתפוצץ בקרוב מאד!",,
201.msg-12-0-18-1-,201.msg,12,0,18,1,21,00000001,"Looks like the fecal material has struck the rotating blades, Captain.","נראה שהחומר הצואתי פגע בלהבים המסתובבים, קפטן.",,
201.msg-13-0-3-1-,201.msg,13,0,3,1,21,00000001,"There's nothing to evade, sir.","אין ממה לחמוק, המפקד.",,
201.msg-13-0-3-2-,201.msg,13,0,3,2,21,00000001,"We have no reason to do that now, Captain.","אין סיבה לעשות את זה עכשיו, קפטן.",,
201.msg-13-0-3-3-,201.msg,13,0,3,3,21,00000001,"We don't have any reason to retreat at present, Captain.","אין שום היגיון בלסגת כרגע, קפטן.",,
201.msg-13-0-4-1-,201.msg,13,0,4,1,21,00000001,"There's nothing around here to evade, bonehead--I mean, Captain.","אין שום דבר בסביבה שאפשר לחמוק ממנו, אהבל--כלומר, קפטן.",,
201.msg-13-0-4-2-,201.msg,13,0,4,2,21,00000001,"You'd have better luck trying to bite an air biscuit, sir.","יש לך יותר סיכוי למכור ריק לאסטרונאוטים, המפקד.",,
201.msg-13-0-4-3-,201.msg,13,0,4,3,21,00000001,You've gotta be kidding!,אתה צוחק עלי!,,
201.msg-13-0-19-1-,201.msg,13,0,19,1,21,00000001,"There's no need to do that while we're cloaked, Captain Wilco.","אין צורך לעשות זאת כשאנחנו מוסווים, קפטן ווילקו.",,
201.msg-13-0-20-1-,201.msg,13,0,20,1,21,00000001,But sir! That will take us directly into an asteroid field. It'd be suicide!,אבל המפקד! זה יקח אותנו היישר אל שדה האסטרואידים. זו תהיה התאבדות.,,
201.msg-13-0-21-1-,201.msg,13,0,21,1,21,00000001,"There's nowhere to hide, Captain!","אין איפה להתחבא, קפטן!",,
201.msg-14-1-0-1-,201.msg,14,1,0,1,99,00000001,All critical communications functions for the Eureka are routed through Flo's console.,כל שידורי התקשורת הקריטיים מנותבים אל היוריקה דרך מסופה של פלו.,,
201.msg-15-0-3-1-,201.msg,15,0,3,1,21,00000001,"Although I wish it were otherwise, there's nothing to shoot at, Captain.","למרות שהייתי רוצה אחרת, אין על מה לירות, קפטן.",,
201.msg-15-0-3-2-,201.msg,15,0,3,2,21,00000001,"I can't shoot if I don't have a target, sir.","אני לא יכול לירות אם אין לי מטרה, המפקד.",,
201.msg-15-0-3-3-,201.msg,15,0,3,3,21,00000001,"Unable to comply, Captain.","בלתי אפשרי, קפטן.",,
201.msg-15-0-4-1-,201.msg,15,0,4,1,21,00000001,Are you nuts?! Fire at what?,אתה מטורף?! לירות על מה?,,
201.msg-15-0-4-2-,201.msg,15,0,4,2,21,00000001,How about I shoot you instead?,אולי אירה בך במקום?,,
201.msg-15-0-4-3-,201.msg,15,0,4,3,21,00000001,"I'll get right on that, sir.","אני כבר מטפל בזה, המפקד.",,
201.msg-15-0-11-1-,201.msg,15,0,11,1,21,00000001,"Weapons systems are not operational, Captain.","מערכות נשק אינן מבצעיות, קפטן.",,
201.msg-15-0-15-1-,201.msg,15,0,15,1,21,00000001,"De-cloaking, sir. Locking weapons...","מבטל הסוואה, המפקד. נועל נשקים...",,
201.msg-15-0-15-2-,201.msg,15,0,15,2,21,00000001,|f3|EAT PLASMA BLOB-FACE!,תאכל פלזמה פרצוף-גוש!,,
201.msg-15-0-18-1-,201.msg,15,0,18,1,21,00000001,"I don't think that would be very helpful, Captain. It will probably just make him madder.","אני לא חושב שזה יהיה מאד מועיל, קפטן. זה כנראה רק יהפוך אותו לעוד יותר עצבני.",,
201.msg-15-0-19-1-,201.msg,15,0,19,1,21,00000001,"We have to de-cloak first, Captain. And I wouldn't recommend that--the Goliath would blast us to atoms before our weapons armed.","עלינו לצאת מההסוואה דבר ראשון, קפטן. ולא הייתי ממליץ על זה--הגוליית תפוצץ אותנו לאטומים עוד לפני שנספיק לחמש את הנשק.",,
201.msg-15-0-22-1-,201.msg,15,0,22,1,21,00000001,"Speaking from personal experience, I've found that firing upon our own ships is generally frowned upon by StarCon Command, Captain.","אני מדבר מתוך ניסיון אישי. גיליתי כי ירי דו-צדדי על כוחותינו אינו מתקבל בעין יפה בקרב מפקדי צבר-כוכבא, קפטן.",,
201.msg-15-0-23-1-,201.msg,15,0,23,1,21,00000001,"I'm sure the Star Confederacy wouldn't appreciate it if you blew a hole in the side of one of their stations, Captain.","אני בטוח שלא יעריכו את זה בצבר-כוכבא אם תפוצץ חור בצלע התחנה שלהם, קפטן.",,
201.msg-15-0-24-1-,201.msg,15,0,24,1,21,00000001,Weapons lock inoperative sir--they're jamming us!,נעילת נשק אינה פעילה המפקד--הם משבשים אותנו!,,
201.msg-16-0-25-1-,201.msg,16,0,25,1,22,00000001,"Captain, I'm intercepting an unusual message on a StarCon frequency. I'll put it on the view screen.","קפטן, יירטתי מסר בלתי שגרתי מתדר צבר-כוכבא. אני אקרין אותו על מסך התצוגה.",,
201.msg-16-0-26-1-,201.msg,16,0,26,1,22,00000001,Captain! I'm picking up a life form reading in the waste compartment!,קפטן! אני קולטת סימני חיים בתא הפסולת!,,
201.msg-16-0-26-2-,201.msg,16,0,26,2,23,00000001,"Captain, you'd better come down here. There are some strange scratching and whining noises coming out of the trash bin.","קפטן, כדאי שתרד לפה מהר. אני שומע רעשים מוזרים של שריטות ויללות בוקעים ממיכל האשפה.",,
201.msg-16-1-0-1-,201.msg,16,1,0,1,99,00000001,"This is Flo, your cheerful, happy-go-lucky communications officer.","זוהי פלו, קצינת הקשר חסרת הדאגות והעליזה שלך.",,
201.msg-17-0-3-1-,201.msg,17,0,3,1,23,00000001,"Yes, Captain.","כן, קפטן.",,
201.msg-17-0-3-2-,201.msg,17,0,3,2,23,00000001,"Yes, sir.","כן, המפקד.",,
201.msg-17-0-3-3-,201.msg,17,0,3,3,23,00000001,"Affirmative, Captain.","חיובי, קפטן.",,
201.msg-17-0-4-1-,201.msg,17,0,4,1,23,00000001,"With alacrity, sir.","בשמחה רבה, המפקד.",,
201.msg-17-0-4-2-,201.msg,17,0,4,2,23,00000001,Right.,נכון.,,
201.msg-17-0-4-3-,201.msg,17,0,4,3,23,00000001,"Sure thing, bucko.","אין בעיה, חביבי.",,
201.msg-18-0-3-1-,201.msg,18,0,3,1,22,00000001,"All systems nominal, Captain.","כל המערכות פועלות כשורה, קפטן.",,
201.msg-18-0-3-2-,201.msg,18,0,3,2,22,00000001,"Communication systems check out, sir.","מערכות תקשורת נבדקו, המפקד.",,
201.msg-18-0-3-3-,201.msg,18,0,3,3,22,00000001,"All com channels on-line and available for use, sir.","כל ערוצי התקשורת מקוונים וזמינים לשימוש, המפקד.",,
201.msg-18-0-4-1-,201.msg,18,0,4,1,22,00000001,"Everything's fine, spud.","הכל בסדר, חמוד.",,
201.msg-18-0-4-2-,201.msg,18,0,4,2,22,00000001,"Great, just great.","מעולה, פשוט מעולה.",,
201.msg-18-0-4-3-,201.msg,18,0,4,3,22,00000001,"Com systems check out, bucko.","מערכות קשר נבדקו, חביבי.",,
201.msg-18-0-13-1-,201.msg,18,0,13,1,22,00000001,"We're toast unless you think of something real quick, Captain.","הלך עלינו אלא אם כן תחשוב על משהו ממש מהר, קפטן.",,
