file-noun-verb-condition-sequence-,file,noun,verb,condition,sequence,talker,padding,text,translation,comment_padding,comment_text
510.msg-4-30-0-1-,510.msg,4,30,0,1,99,00000001,Why don't you try roasting marshmallows with it instead? Sheesh!,למה שלא תנסה לצלות על זה מרשמלו במקום? אלוהים!,,
510.msg-5-1-0-1-,510.msg,5,1,0,1,99,00000001,This area of the Space Station houses spacebar patrons whose recreational activities go beyond accepted standards of polite society.,אזור זה של תחנת החלל משכן את סועדי הבר-כוכבא שפעילויות הפנאי שלהם חורגות הרבה מעבר לסטנדרטים המקובלים בחברה מתוקנת.,,
510.msg-6-1-0-1-,510.msg,6,1,0,1,99,00000001,This cell appears to be as empty as the orb atop your shoulders...,התא הזה נראה ריק כמו הכדור שמעל לכתפיך...,,
510.msg-7-1-0-1-,510.msg,7,1,0,1,99,00000001,An invisible forcefield blocks your path.,שדה כוח בלתי נראה חוסם את דרכך.,,
510.msg-8-1-0-1-,510.msg,8,1,0,1,99,00000001,This security guard had recently undergone sensitivity training and  now likes to read his victims poetry before beating them unconscious.,המאבטח הזה עבר לא מזמן סדנת רגישות וכעת מקריא לקרבנותיו שירה לפני שהוא מכסח להם את הצורה.,,
510.msg-8-2-0-1-,510.msg,8,2,0,1,42,00000001,Get lost pinhead!,לך לעזאזל מפגר!,,
510.msg-8-2-0-2-,510.msg,8,2,0,2,42,00000001,I said take a hike! ,אמרתי עוף מפה!,,
510.msg-8-2-0-3-,510.msg,8,2,0,3,42,00000001,"Scram, pee-wee!","'תחפף, פצפון!",,
510.msg-9-1-0-1-,510.msg,9,1,0,1,99,00000001,"StarCon security police are normally irritable, surly and generally of poor disposition, except on those rare occasions they feel something is important enough to get really angry about it.","משטרת צבר-כוכבא בדרך כלל עצבנית, זעפנית ובאופן כללי בעלת אופי מריר, למעט מקרים נדירים שהם מרגישים שמשהו מספיק חשוב בשביל ממש להתרגז בגללו.",,
510.msg-9-2-0-1-,510.msg,9,2,0,1,43,00000001,"Buzz off, DOINK. Looking at you gives me a headache.","ס'תלק מפה, פסיכי. רק מלהסתכל עליך נהיה לי כאב ראש.",,
510.msg-9-2-0-2-,510.msg,9,2,0,2,43,00000001,Did your mother have any children who lived?,לאמא שלך יש ילדים בחיים?,,
510.msg-9-2-0-3-,510.msg,9,2,0,3,43,00000001,"Drop dead, monkey boy.","לך תמות, קופיקו.",,
510.msg-10-0-0-1-,510.msg,10,0,0,1,42,00000001,Halt! Who goes there!,עצור! מי זה שם הולך?,,
510.msg-10-0-0-2-,510.msg,10,0,0,2,42,00000001,Stop!,עצור!,,
510.msg-10-0-0-3-,510.msg,10,0,0,3,42,00000001,Actung! Verboten!,אכטונג! וורבוטן!,,
510.msg-11-0-1-1-,510.msg,11,0,1,1,19,00000001,|c2||f4|Yow!|c||f|,|c2||f4|!יואו|c||f|,,
510.msg-11-0-1-2-,510.msg,11,0,1,2,42,00000001,Ha-ha!,חה-חה!,,
510.msg-11-0-1-3-,510.msg,11,0,1,3,43,00000001,"Sorry about that jolt, I just now turned the force field  off. Go on in.","מצטער בקשר לטלטלה, רק עכשיו כיביתי את שדה הכוח. אתה יכול להיכנס.",,
510.msg-11-0-2-1-,510.msg,11,0,2,1,19,00000001,|f3|Yeeeow!|f|,|f3|!יואוווו|f|,,
510.msg-11-0-2-2-,510.msg,11,0,2,2,42,00000001,Ha! Whatta dweeb!,חה! מה קורה דביל!,,
510.msg-11-0-2-3-,510.msg,11,0,2,3,43,00000001,I can't believe he fell for the old ''shut off the power'' trick! Ha-ha!,"אני לא מאמין שהטריק הישן ""נתק את החשמל"" עבד עליו! חה-חה!",,
510.msg-11-0-3-1-,510.msg,11,0,3,1,19,00000001,Ouch!,אאוץ'!,,
510.msg-11-0-3-2-,510.msg,11,0,3,2,19,00000001,Ugh!,אוח!,,
510.msg-11-0-3-3-,510.msg,11,0,3,3,19,00000001,Zoinks!,אמאל'ה!,,
520.msg-0-0-0-1-,520.msg,0,0,0,1,45,00000001,"Hello... I am your cocktail waitress analog, Bzzzzt.","שלום... אני מלצרית הקוקטיילים האנלוגית שלך, בזזזזט.",,
520.msg-0-0-0-2-,520.msg,0,0,0,2,45,00000001,"What's your poison, humanoids?","מה תרצה לשתות, בן אנוש?",,
520.msg-0-0-0-3-,520.msg,0,0,0,3,19,00000001,I'll have a double bourbon on the rocks.,אשמח לבורבון כפול עם קרח.,,
520.msg-0-0-0-4-,520.msg,0,0,0,4,22,00000001,I'll have a fuzzy nostril.,אני אשתה נחיר שעיר.,,
520.msg-0-0-0-5-,520.msg,0,0,0,5,21,00000001,Give me a green goblin.,תני לי גובלין ירוק.,,
520.msg-0-0-0-6-,520.msg,0,0,0,6,45,00000001,Here are your Bzzzzt... drinks.,הנה הבזזזזט... המשקאות שלכם.,,
520.msg-0-0-0-7-,520.msg,0,0,0,7,45,00000001,The charges will be deducted from your StarCon account. ,החיוב ינוכה מחשבון הצבר-כוכבא שלכם.,,
520.msg-0-0-0-8-,520.msg,0,0,0,8,45,00000001,"If you feel the urge to 'hurl', please feel free to use the rest rooms, humans.","אם אתם מרגישים דחף 'להקיא', תרגישו חופשי להשתמש בחדרי השירותים שלנו, בני אדם.",,
520.msg-1-1-0-1-,520.msg,1,1,0,1,99,00000001,Droole is enjoying a strange concoction called a green goblin.,דרול נהנה ממרקחת מוזרה שנקראת גובלין ירוק.,,
520.msg-1-34-0-1-,520.msg,1,34,0,1,99,00000001,Don't put your thingys in MY drink!,אל תשים את הדברים שלך במשקה שלי!,,
520.msg-2-1-0-1-,520.msg,2,1,0,1,99,00000001,"He looks, smells, talks, sounds and acts like navigation officer Droole. ","הוא נראה, מריח, מדבר, נשמע ומתנהג כמו קצין ניווט דרול.",,
520.msg-2-31-0-1-,520.msg,2,31,0,1,99,00000001,Get your pet thing away from me!,תעיף את החיה שלך ממני!,,
520.msg-2-2-0-1-,520.msg,2,2,0,1,19,00000001,"Why did you say 'Uh-oh, here we go again?' when we came into the bar?","למה אמרת 'הו-הו, הנה זה בא שוב,' כשנכנסנו לבר?",,
520.msg-2-2-0-2-,520.msg,2,2,0,2,21,00000001,Cliffy had a slight misunderstanding with a crew member from the 'Intrepid' the last time we came in here.,לצוקי היתה אי הבנה קלה עם איש צוות מה'נועזת' בפעם האחרונה שביקרנו כאן.,,
520.msg-2-2-0-3-,520.msg,2,2,0,3,19,00000001,What do you mean by 'slight misunderstanding'?,למה אתה מתכוון ב'אי הבנה קלה'?,,
520.msg-2-2-0-4-,520.msg,2,2,0,4,21,00000001,Apparently Cliffy made some colorful speculations about this crewmember's parentage...,מסתבר שצוקי העלה כמה השערות צבעוניות בקשר למוצאו הביולוגי של איש הצוות...,,
520.msg-2-2-0-5-,520.msg,2,2,0,5,21,00000001,Then he proceeded to make some unflattering anatomical references...,ואז הוא המשיך להערות אנטומיות פוגעניות...,,
520.msg-2-2-0-6-,520.msg,2,2,0,6,19,00000001,I get the idea...,הבנתי את הרעיון...,,
520.msg-2-2-0-7-,520.msg,2,2,0,7,22,00000001,Males! You can't live with them and sometimes you can't even housetrain them!,זכרים! אתה לא יכול לחיות איתם ולפעמים אתה גם לא יכול לביית אותם!,,
520.msg-2-2-0-8-,520.msg,2,2,0,8,22,00000001,"Why, that reminds me of my fourteenth husband, Vlad. |f8|he|f| was always brawling...","זה מזכיר לי את בעלי מספר ארבע עשרה, ולד.|f8|הוא|f| תמיד אהב להתקוטט...",,
520.msg-2-2-0-9-,520.msg,2,2,0,9,21,00000001,"The captain doesn't have time to listen to one of your fascinating personal narratives right now, Flo.","לקפטן אין זמן להקשיב כרגע לאחד מהסיפורים האישיים המרתקים שלך, פלו.",,
520.msg-2-2-0-10-,520.msg,2,2,0,10,21,00000001,"He has to figure out how to get Cliffy out of the slammer! Right, sir?","הוא צריך לחשוב על פתרון איך לשחרר את צוקי מהכלא! נכון, המפקד?",,
520.msg-2-2-0-11-,520.msg,2,2,0,11,19,00000001,"Uh, yeah...","אה, כן...",,
520.msg-2-2-0-12-,520.msg,2,2,0,12,21,00000001,"See! I told you the captain wasn't a |c3|complete|c| closet case, Flo! I'm with you, sir! Let's go blast him out!","רואה! אמרתי לך שהקפטן אינו מקרה אבוד  |c3|לחלוטין|c|, פלו! אני איתך, המפקד! בוא נפוצץ אותו החוצה!",,
520.msg-2-2-0-13-,520.msg,2,2,0,13,19,00000001,"That's a fine idea Droole, but it would draw too much attention... There's got to be a better way.","הרעיון מצוין דרול, אבל הוא ימשוך יותר מדי תשומת לב... חייבת להיות דרך טובה יותר.",,
520.msg-2-2-1-1-,520.msg,2,2,1,1,21,00000001,Why don't you get started on your 'project' sir.,אולי תתחיל ב'פרויקט' שלך המפקד.,,
520.msg-3-1-0-1-,520.msg,3,1,0,1,99,00000001,Flo is sipping a fuzzy nostril.,פלו לוגמת נחיר שעיר.,,
520.msg-3-34-0-1-,520.msg,3,34,0,1,99,00000001,Not in |c3|MY|c| drink!,לא במשקה |c3|שלי!|c|,,
520.msg-4-1-0-1-,520.msg,4,1,0,1,99,00000001,Flo wears the same laconic expression she always does when burdened with your presence.,פלו עוטה את אותה הבעה לקונית נצחית בשעה שהיא שוהה במחיצתך.,,
520.msg-4-31-0-1-,520.msg,4,31,0,1,99,00000001,Put that slimy thing back in your pocket!,תחזיר את הדבר החלקלק הזה לכיס!,,
520.msg-4-2-0-1-,520.msg,4,2,0,1,22,00000001,"Did you notice the alien sitting with Quirk in the upper booth when we came in, Captain?","האם הבחנת בחייזר שישב עם קווירק בביתן העליון כשנכנסנו, קפטן?",,
520.msg-4-2-0-2-,520.msg,4,2,0,2,19,00000001,What about him?,מה איתו?,,
520.msg-4-2-0-3-,520.msg,4,2,0,3,22,00000001,"Well, I have an excellent memory for cranial configurations, and I'd swear it was the same creature we saw in that transmission we intercepted.","ובכן, יש לי זיכרון מצוין לתצורות גולגלתיות, ואני מוכן להישבע שזה היה אותו יצור שראינו בתשדורת שיירטנו.",,
520.msg-4-2-0-4-,520.msg,4,2,0,4,19,00000001,What do you suppose it was doing with Quirk?,מה לדעתך היו מעשיו עם קווירק?,,
520.msg-4-2-0-5-,520.msg,4,2,0,5,22,00000001,"I haven't any idea. What do you think, Droole?","אין לי מושג. מה אתה חושב, דרול?",,
520.msg-4-2-0-6-,520.msg,4,2,0,6,21,00000001,Beats me! I didn't even see the guy when we came in.,אין לי שמץ! אפילו לא ראיתי את הבחור כשנכנסנו.,,
520.msg-4-2-1-1-,520.msg,4,2,1,1,22,00000001,"I don't feel like talking much right now, sir. This whole incident has thrown my biorythms out of whack. ","לא מתחשק לי לדבר כרגע, המפקד. כל התקרית הזו גרמה לתהליכים הפיזיולוגיים שלי לצאת מכלל שליטה.",,
520.msg-4-2-1-2-,520.msg,4,2,1,2,22,00000001,I need to go back to the ship and meditate with my crystals.,אני צריך לחזור לספינה ולהתייחד עם הגבישים שלי.,,
520.msg-5-0-0-1-,520.msg,5,0,0,1,25,00000001,"Well, well, well, look who it isn't.","ובכן, תראו מי זה.",,
520.msg-5-0-0-2-,520.msg,5,0,0,2,19,00000001,"Buzz off, laser-brain!","עוף מכאן, מוח-לייזר!",,
520.msg-5-0-0-3-,520.msg,5,0,0,3,25,00000001,"Enjoying your new command, trash-man? I recommended you for the job.","נהנה מהמפקדה החדשה שלך, איש-זבל? אני המלצתי עליך לתפקיד.",,
520.msg-5-0-0-4-,520.msg,5,0,0,4,19,00000001,"That's 'Sanitation Engineer' to you, crumb.","זה 'מהנדס תברואה' בשבילך, כלומניק.",,
520.msg-5-0-0-5-,520.msg,5,0,0,5,25,00000001,Oooh! An aristocrat! I bet Ambassador Wankmeister would be really impressed!,הווו! אריסטוקרט! אני בטוח שהשגרירה וונקמייסטר מאד תתרשם!,,
520.msg-5-0-0-6-,520.msg,5,0,0,6,25,00000001,She and I are having a great time working together--closely--on the Goliath.,אני והיא מאד נהנים לעבוד ביחד--צמוד--על הגוליית.,,
520.msg-5-0-0-7-,520.msg,5,0,0,7,19,00000001,"Quirk, you have the looks of an Orat and the manners to match!","קווירק, יש לך מראה של אורט ונימוסים בהתאמה!",,
520.msg-5-0-0-8-,520.msg,5,0,0,8,25,00000001,Why you little... I could have you brought up on charges for that!,יא חתיכת... אני יכול לתפור לך תיק על זה!,,
520.msg-5-0-0-9-,520.msg,5,0,0,9,25,00000001,"I demand satisfaction! I challenge you to a game of Battle Cruiser, wimp!","אני דורש דו-קרב! אני מזמין אותך למשחק 'חלליות', נמושה!",,
520.msg-5-0-0-10-,520.msg,5,0,0,10,19,00000001,"Fine! I'm going to kick your aft side into the next quadrant, Quirk!","מצוין! אני אבעט לך בירכתיים לרובע הבא, קווירק!",,
520.msg-5-0-0-11-,520.msg,5,0,0,11,25,00000001,"Ha! We'll see about that, broom jockey!","חה! אנחנו עוד נראה, רוכב מטאטאים!",,
520.msg-6-4-0-1-,520.msg,6,4,0,1,99,00000001,You can't bring yourself to sample your drink: It looks and smells like the bartender dumped a spittoon into your glass.,אתה לא מסוגל לטעום מהמשקה: זה נראה ומריח כאילו המוזג שפך מרקקה שלמה לתוך הכוס.,,
520.msg-6-1-0-1-,520.msg,6,1,0,1,99,00000001,The drink doesn't look very appealing. Maybe you should have opted for a Kerona Lite instead.,המשקה לא נראה מאד מושך. אולי הייתי צריך לבקש קרונה דיאט במקום.,,
520.msg-7-2-0-1-,520.msg,7,2,0,1,99,00000001,Your crew might think you're a bit touched in the head if keep trying to talk to your self...,הצוות שלך עוד עלול לחשוב שמשהו לא בסדר אצלך בראש אם תמשיך לנסות לדבר לעצמך...,,
520.msg-8-0-0-1-,520.msg,8,0,0,1,38,00000001,"Hello there, suck... I mean, pardner. May I have a moment?","שלום לך, מוצץ... כלומר, שותף. אפשר דקה מזמנך?",,
520.msg-8-0-0-2-,520.msg,8,0,0,2,19,00000001,"Well, actually I'm kinda...","ובכן, האמת אני...",,
520.msg-8-0-0-3-,520.msg,8,0,0,3,38,00000001,"Allow me to introduce myself: The name's Nelo Jones, Merchant of Venus.","תרשה לי להציג את עצמי: השם נלו ג'ונס, רוכל מנוגה.",,
520.msg-8-0-0-4-,520.msg,8,0,0,4,38,00000001,Dealer in fine collectibles. Trafficker in rare artifacts. What's your moniker son?,סוחר בפריטי אספנות. תגרן של חפצים נדירים. מה הכינוי שלך בני?,,
520.msg-8-0-0-5-,520.msg,8,0,0,5,19,00000001,I'm uh... Roger Wilco.,אני אה... רוג'ר ווילקו.,,
520.msg-8-0-0-6-,520.msg,8,0,0,6,38,00000001,"Well Wilco, this is your lucky day!","ובכן ווילקו, זהו יום המזל שלך!",,
520.msg-8-0-0-7-,520.msg,8,0,0,7,38,00000001,I could tell the first minute I set eyes on you that you're a discerning individual with an IQ significantly higher than the chair he was sitting in.,מהרגע הראשון ששמתי עליך עין הבנתי שאתה אדם בררן עם מנת משכל גבוהה משמעותית מהכיסא שעליו אתה יושב.,,
520.msg-8-0-0-8-,520.msg,8,0,0,8,38,00000001,A man who knows the value of fine merchandise when he sees it.,אדם שיודע להכיר בערכה של סחורה משובחת כשהוא רואה אחת.,,
520.msg-8-0-0-9-,520.msg,8,0,0,9,19,00000001,"Well, um...","ובכן, המ...",,
520.msg-8-0-0-10-,520.msg,8,0,0,10,38,00000001,"Never fear Wilco, Nelo can fix you right up!","אל דאגה ווילקו, נלו יפנק אותך כמו שצריך!",,
520.msg-8-0-0-11-,520.msg,8,0,0,11,38,00000001,Need some Antarean fire water? A few gray market copies of the latest Thing's Quest game? Or a lucky tribble's foot?,צריך מי אש אנטריאנים? עותקי שוק אפור של משחק מסע בדבר האחרון? או רגל טריבל למזל?,,
520.msg-8-0-0-12-,520.msg,8,0,0,12,38,00000001,How about some Chernobyl cufflinks? They're a collector's item you know: guaranteed to give you that 'warm glow' like only hard radiation can.,מה לגבי חפתי צ'רנוביל? הם פריט אספנות אתה יודע: הם מעניקים לך באחריות את אותה 'הילה חמימה' כמו שרק קרינה חזקה יודעת.,,
520.msg-8-0-0-13-,520.msg,8,0,0,13,19,00000001,I don't think...,אני לא חושב...,,
520.msg-8-0-0-14-,520.msg,8,0,0,14,38,00000001,"I can see you're looking  for something special, Roger. Can I call you Roger? Well I've got just the thing...","אני רואה שאתה מחפש משהו מיוחד, רוג'ר. אני יכול לקרוא לך רוג'ר? ובכן, יש לי בדיוק את הדבר...",,
520.msg-8-0-0-15-,520.msg,8,0,0,15,38,00000001,Dehydrated Space Monkeys! They're all the rage in the colony worlds. You don't have to feed 'em and there's no mess. For you: 15 buckazoids.,קופי חלל מיובשים! הם הדבר הבא בעולמות המושבות. אתה לא צריך להאכיל אותם ואין שום לכלוך. בשבילך: 15 זוזואידים.,,
520.msg-8-0-0-16-,520.msg,8,0,0,16,19,00000001,I'm not sure...,אני לא בטוח...,,
520.msg-8-0-0-17-,520.msg,8,0,0,17,38,00000001,"You drive a hard bargain, Rog! I tell you what, you take a free sample of  space monkeys and my business card, with my compliments...","אתה מנהל מו""מ קשוח, רוג'! אני אגיד לך מה, אתה מקבל דוגמית חינם של קוף חלל וכרטיס ביקור שלי, על חשבון הבית...",,
520.msg-8-0-0-18-,520.msg,8,0,0,18,38,00000001,Then you buy something for your lady friend the next time you pass through here.,ואז אתה קונה משהו לחברה שלך בפעם הבאה שאתה עובר כאן.,,
520.msg-8-0-0-19-,520.msg,8,0,0,19,19,00000001,"Um, thanks...","המ, תודה...",,
520.msg-8-0-0-20-,520.msg,8,0,0,20,99,00000001,"Realizing he's not going to make a big score here, the salesbeast moves off to find another victim...","בהבינו שהוא לא הולך לעשות פה קופה גדולה, מפלצת המכירות ממשיך הלאה לחיפוש קורבן חדש...",,
530.msg-1-1-0-1-,530.msg,1,1,0,1,99,00000001,"The cell is constructed of tritanium, plasteel, and ferro-concrete. The word 'impregnable' springs to mind as you stare at it.","התא בנוי מטריטניום, פלדסטיק, ובטון מזוין. המונח 'בלתי חדיר' קופץ לך לראש כשאתה בוהה בו.",,
530.msg-1-30-0-1-,530.msg,1,30,0,1,23,00000001,You'll fry your chief engineer!,אתה תטגן את קצין ההנדסה שלך!,,
530.msg-2-0-0-1-,530.msg,2,0,0,1,23,00000001,"I guess that little beastie is good for something after all, sir.","אני מניח שהמפלצת הקטנה שלך שווה משהו בסופו של יום, המפקד.",,
530.msg-3-1-0-1-,530.msg,3,1,0,1,99,00000001,Cliffy is locked up tighter than the sphinctoid on a Rigelleian Waterfowl.,צוקי נעול יותר חזק מאשר סוגרי עופות מים ריגליאנים.,,
530.msg-3-2-0-1-,530.msg,3,2,0,1,99,00000001,"Hurry up, Captain! We don't have much time!","תזדרז, קפטן! אין לנו הרבה זמן!",,
530.msg-3-2-0-2-,530.msg,3,2,0,2,99,00000001,We'll don't just stand there with your teeth in your mouth! Get me outta here!,אל תעמוד שם כמו פדלאה! תוציא אותי מפה!,,
530.msg-3-2-0-3-,530.msg,3,2,0,3,99,00000001,"Cap'n, you gotta spring me!","קפטן, אתה חייב לשחרר אותי!",,
530.msg-3-30-0-1-,530.msg,3,30,0,1,23,00000001,"Uh, captain, I'd like to get out of here, but I'd also like to avoid getting roasted in the process if at all possible.","אה, קפטן, הייתי שמח לצאת מפה, אבל גם הייתי שמח שלא להיצלות בתהליך אם זה אפשרי.",,
530.msg-4-0-0-1-,530.msg,4,0,0,1,23,00000001,"Boy! Am I glad to see you, Cap'n!","בחיי! כמה שאני שמח לראות אותך, קפטן!",,
530.msg-4-0-0-2-,530.msg,4,0,0,2,19,00000001,"You've got yourself in a fine predicament this time, Cliffy.","הפעם הכנסת את עצמך לבלגן רציני, צוקי.",,
530.msg-4-0-0-3-,530.msg,4,0,0,3,23,00000001,"I'm sorry Cap'n, but it wasn't my fault!","אני מצטער קפטן, אבל זה לא היה באשמתי!",,
530.msg-4-0-0-4-,530.msg,4,0,0,4,19,00000001,"I know Cliffy, I know...","אני יודע צוקי, אני יודע...",,
530.msg-4-0-0-5-,530.msg,4,0,0,5,23,00000001,You're not goin' to just leave me here to rot in this tiny cell for the rest of my life are you?,"אתה לא מתכוון להשאיר אותי להירקב בתא הזעיר הזה לשארית חיי, נכון?",,
530.msg-4-0-0-6-,530.msg,4,0,0,6,19,00000001,"Of course not, Cliffy. The Eureka isn't going anywhere without her chief engineer.","ברור שלא, צוקי. היוריקה לא הולכת לשום מקום בלי קצין ההנדסה שלה.",,
530.msg-4-0-0-7-,530.msg,4,0,0,7,19,00000001,"Heck, nobody else can even figure out half the jury-rigged contraptions you've installed.","לעזאזל, אף אחד לא יכול להבין אפילו חצי מהחידושים המאולתרים שהתקנת.",,
530.msg-4-0-0-8-,530.msg,4,0,0,8,23,00000001,"It's nice to feel needed, sir.","נחמד להרגיש נחוץ, המפקד.",,
530.msg-4-0-0-9-,530.msg,4,0,0,9,19,00000001,Now all we have to is get you out of here. Any ideas?,עכשיו כל מה שנותר לנו זה להוציא אותך החוצה מפה. יש רעיונות?,,
530.msg-4-0-0-10-,530.msg,4,0,0,10,23,00000001,Not a one sir... Maybe you can find something that will get through these bars.,אפילו לא אחד המפקד... אולי תוכל למצוא משהו שיעבור דרך הסורגים.,,
530.msg-4-0-0-11-,530.msg,4,0,0,11,23,00000001,"But be careful, it's mighty cramped quarters in here and I'd like to make it out in one piece.","אבל תיזהר, מאד צפוף כאן ואני רוצה לצאת בחתיכה אחת.",,
530.msg-4-0-1-1-,530.msg,4,0,1,1,23,00000001,"Talk is cheap Captain, I think you'd better find me a way outta here.","קל לדבר קפטן, נדמה לי שעדיף שתמצא דרך לצאת מכאן.",,
530.msg-5-4-0-1-,530.msg,5,4,0,1,99,00000001,That will have absolutely no beneficial effect on the lock mechanism.,לא יהיה לזה שום השפעה ממשית על מנגנון הנעילה.,,
530.msg-5-1-0-1-,530.msg,5,1,0,1,99,00000001,The cell is closed with an impressively heavy looking lock mechanism.,התא נעול במנגנון נעילה כבד ומרשים למראה.,,
530.msg-5-30-0-1-,530.msg,5,30,0,1,99,00000001,I'm sure Cliffy would prefer that you didn't try to roast him alive.,אני בטוח שצוקי יעדיף שלא תנסה לצלות אותו בחיים.,,
530.msg-6-1-0-1-,530.msg,6,1,0,1,99,00000001,"Your little buddy, Spike.","חברך הקטן, קוץ.",,
620.msg-1-1-0-1-,620.msg,1,1,0,1,99,00000001,A flashing red button catches your eye. You surmise that it is somehow connected with the homing beacon.,כפתור אדום מהבהב לוכד את מבטך. אתה משער שהוא איכשהו קשור לאות האיתור.,,
620.msg-2-1-0-1-,620.msg,2,1,0,1,99,00000001,Q: What was the last thing to go through the Space Hero's mind as he hit the ground after falling from the 10000 foot cliff?,"ש: מה הדבר האחרון שעבר בראשו של גיבור החלל בשניה שפגע בקרקע לאחר נפילה מצוק בגובה 3 ק""מ?",,
620.msg-2-1-0-2-,620.msg,2,1,0,2,99,00000001,A: His boots.,ת: המגפיים שלו.,,
620.msg-3-1-0-1-,620.msg,3,1,0,1,99,00000001,This frock probably belonged to the recent occupant of the escape pod.,החלוק הזה כנראה היה שייך לדייר האחרון של תרמיל המילוט.,,
620.msg-4-4-0-1-,620.msg,4,4,0,1,99,00000001,You'll need to get a little closer before you can touch it. ,תצטרך לגשת יותר קרוב לפני שתוכל לגעת בזה.,,
620.msg-4-1-0-1-,620.msg,4,1,0,1,99,00000001,The interior of the craft is not visible from your present location. All you can tell from here is that it looks like an escape pod.,פנים רכב החלל אינו גלוי ממיקומך הנוכחי. כל מה שאתה יכול לדעת מכאן זה שזה נראה כמו תרמיל מילוט.,,
620.msg-5-1-0-1-,620.msg,5,1,0,1,99,00000001,Whoever used this pod can't be far away...,מי שלא השתמש בתרמיל הזה לא יכול להיות מאד רחוק...,,
620.msg-6-1-0-1-,620.msg,6,1,0,1,99,00000001,I wouldn't get too close if to the edge if I were you...,לא הייתי מתקרב לשפה יותר מדי אילו הייתי במקומך...,,
620.msg-7-1-0-1-,620.msg,7,1,0,1,99,00000001,It appears the pod still has some reserve battery power.,עושה רושם שסוללת התרמיל עדיין טעונה.,,
620.msg-8-0-1-1-,620.msg,8,0,1,1,22,00000001,"Cliffy says he's ready when you are, Captain.","צוקי אומר שהוא מוכן כשאתה מוכן, קפטן.",,
620.msg-8-0-1-2-,620.msg,8,0,1,2,19,00000001,        ENERGIZE!,שגר!,,
620.msg-8-0-2-1-,620.msg,8,0,2,1,22,00000001,I've got a splitting headache and the planter's wart in my left foot is starting to abscess.,יש לי כאב ראש נוראי והיבלת הנגיפית בכף רגלי השמאלית מתחילה להזדהם.,,
620.msg-8-0-2-2-,620.msg,8,0,2,2,22,00000001,"Other than that it's just peachy. How about you, sir? Discover anything interesting down there on that third rate planet?","חוץ מזה הכל תותים. ואיך אצלך, המפקד? גילית משהו מעניין שם למטה על הכוכב סוג ג' הזה?",,
