file-noun-verb-condition-sequence-,file,noun,verb,condition,sequence,talker,padding,text,translation,comment_padding,comment_text
225.msg-14-1-0-1-,225.msg,14,1,0,1,99,00000001,These controls open the door to the trash compartment.,בקרים אלה פותחים את הדלת אל תא הזבל.,,
225.msg-22-1-0-1-,225.msg,22,1,0,1,99,00000001,The thick metal door strains in protest as the massive pukoid blob creature tries to liberate itself from the confines of the trash compartment.,דלת המתכת העבה חורקת במחאה כאשר היצור הגושי המסיבי מנסה לשחרר את עצמו מגבולות תא הזבל.,,
225.msg-15-1-0-1-,225.msg,15,1,0,1,99,00000001,Behind this door is the Eureka's Refuse Containment Compartment.,מאחורי דלת זו שוכן תא הטמנת האשפה.,,
225.msg-16-4-0-1-,225.msg,16,4,0,1,19,00000001,Naw! I'm sure Cliffy won't mind cleaning it up!,לא! אני בטוח שצוקי ישמח לנקות את זה!,,
225.msg-16-1-0-1-,225.msg,16,1,0,1,99,00000001,"It has the appearance and aroma of rotting garbage. My, what a lovely smell you've discovered...","יש לזה מראה וניחוח של אשפה מרקיבה. בחיי, איזה ריח נפלא גילית...",,
226.msg-1-1-0-1-,226.msg,1,1,0,1,99,00000001,This appears to be a roll of anti-acid tablets.,נראה שזו חפיסה של טבליות נוגדות חומצה.,,
226.msg-2-1-0-1-,226.msg,2,1,0,1,99,00000001,"Cliffy's toolbox is filled with miscellaneous bits of junk and tools of every size, shape, and description.","ארגז הכלים של צוקי מלא בחלקי גרוטאות ובכלים מכלים שונים מכל הגדלים, הצורות, והמינים.",,
226.msg-3-4-0-1-,226.msg,3,4,0,1,99,00000001,CLEAN UP TOOLBOX,נקה ארגז כלים,,
226.msg-3-1-0-1-,226.msg,3,1,0,1,99,00000001,This button activates the toolbox's automatic cleaning function.,כפתור זה מפעיל את פונקציית הניקוי האוטומטי של ארגז הכלים.,,
226.msg-4-1-0-1-,226.msg,4,1,0,1,99,00000001,It's a small drill.,מקדחה קטנה.,,
226.msg-5-1-0-1-,226.msg,5,1,0,1,99,00000001,It's a large drill.,מקדחה גדולה.,,
226.msg-6-1-0-1-,226.msg,6,1,0,1,99,00000001,It has the appearance of a turkey baster. Wonder what Cliffy uses it for.,יש לזה חזות של מזלף. מעניין למה צוקי צריך את זה.,,
226.msg-7-4-0-1-,226.msg,7,4,0,1,99,00000001,EXIT,יציאה,,
226.msg-7-1-0-1-,226.msg,7,1,0,1,99,00000001,Exit.,יציאה.,,
226.msg-8-1-0-1-,226.msg,8,1,0,1,99,00000001,Spare fuse.,נתיך חילופי.,,
226.msg-9-1-0-1-,226.msg,9,1,0,1,99,00000001,It's a doo hickey.,זה מה שמו.,,
226.msg-10-1-0-1-,226.msg,10,1,0,1,99,00000001,High tech thingamabob.,מה שמו טכנולוגי מתקדם.,,
226.msg-11-1-0-1-,226.msg,11,1,0,1,99,00000001,A whatchamacallit.,איך-שלא-קוראים-לזה.,,
226.msg-12-1-0-1-,226.msg,12,1,0,1,99,00000001,A space gizmo.,אביזר חלל.,,
226.msg-13-1-0-1-,226.msg,13,1,0,1,99,00000001,This device is specially designed to cut through the shrink wrap on software packages.,מכשיר זה תוכנן במיוחד לחיתוך עטיפות ניילון על אריזות תוכנה.,,
226.msg-14-1-0-1-,226.msg,14,1,0,1,99,00000001,A hot glue gun. Great for a laugh on unsuspecting party guests.,אקדח דבק חם. מעולה לבדיחות על חשבון אורחי מסיבה תמימים.,,
226.msg-15-1-0-1-,226.msg,15,1,0,1,99,00000001,This is Cliffy's tool of choice when working on the Eureka's delicate and temperamental electronics systems.,זה הכלי המועדף על צוקי כאשר הוא עובד על מערכות החשמל ההפכפכות והמעודנות של היוריקה.,,
226.msg-16-1-0-1-,226.msg,16,1,0,1,99,00000001,It's a hole punch. Heaven knows what Cliffy uses this for.,מחורר. השם יודע מה צוקי עושה עם זה.,,
226.msg-17-4-0-1-,226.msg,17,4,0,1,99,00000001,PUT IN INVENTORY,הכנס למלאי,,
226.msg-17-1-0-1-,226.msg,17,1,0,1,99,00000001,This button adds an item to your inventory.,כפתור זה מוסיף חפצים למלאי שלך.,,
226.msg-18-1-0-1-,226.msg,18,1,0,1,99,00000001,It's a pizza wheel to cutta your pizza-pie.,זה גלגל פיצה כדי לחתוך את פשטידת הפיצה שלך.,,
226.msg-19-1-0-1-,226.msg,19,1,0,1,99,00000001,A pair of pliers.,צבת.,,
226.msg-20-1-0-1-,226.msg,20,1,0,1,99,00000001,A screwdriver. ,מברג.,,
226.msg-21-1-0-1-,226.msg,21,1,0,1,99,00000001,Spark plug.,מצת.,,
226.msg-22-0-1-1-,226.msg,22,0,1,1,99,00000001,You don't need this tool.,אתה לא צריך את הכלי הזה.,,
226.msg-22-0-2-1-,226.msg,22,0,2,1,99,00000001,"In order not to irk Cliffy, you put back the tools where you found them.","על מנת שלא להרגיז את צוקי, אתה מניח בחזרה את הכלים במקום שמצאת אותם.",,
226.msg-22-0-3-1-,226.msg,22,0,3,1,99,00000001,"Thinking this might be a handy item, you take it with you.","בהרהרך על כך כי פריט זה עשוי להביא תועלת, אתה לוקח אותו איתך.",,
226.msg-23-1-0-1-,226.msg,23,1,0,1,99,00000001,A Schmears brand Crafts-alien laser cutting torch.,מבער ריתוך לייזר מלאכת-חייזר תוצרת שמיר.,,
226.msg-24-1-0-1-,226.msg,24,1,0,1,99,00000001,"It's one of those nifty portable, hand-held vacuums. You know, the kind that can't even pick up bread crumbs.","זהו אחד מאותם שואבי אבק ידניים, ניידים ומתוחכמים. אתה יודע, מהסוג ששואב אפילו פירורי לחם.",,
226.msg-25-1-0-1-,226.msg,25,1,0,1,99,00000001,I don't think you'd be able to wrench this tool away from Cliffy.,אני לא חושב שתצליח לשלוף את הכלי הזה מצוקי.,,
228.msg-0-0-0-1-,228.msg,0,0,0,1,99,00000001,"Realizing it's not a good idea to interrupt the power to critically important circuits, you replace the fuses before leaving.","משהבנת שאין זה רעיון טוב לקטוע את החשמל מלזרום בחופשיות במעגלים חשובים, אתה מחליף את הנתיכים לפני שאתה עוזב.",,
228.msg-5-0-0-1-,228.msg,5,0,0,1,99,00000000,"Thinking it might come in handy later, you put the extra fuse back in your pocket.","עולה בדעתך כי הדבר עשוי להביא תועלת בהמשך, ומאפסן את הנתיך הנוסף בכיסך.",,
228.msg-1-0-0-1-,228.msg,1,0,0,1,99,00000001,Scrutinizing the diagram below the power bus you see the  word ''Lighting'' on the schematic next to this fuse.,"בבחינת התרשים מתחת לאפיק החשמל אתה קורא את המילה ""תאורה"" על השרטוט ליד הנתיך.",,
228.msg-1-0-0-2-,228.msg,1,0,0,2,99,00000001,The wiring chart indicates this fuse controls the Main Transporter Power Coupling.,תרשים החיווט מלמד כי נתיך זה שולט על ממסר הפחת של המשגר הראשי.,,
228.msg-1-0-0-3-,228.msg,1,0,0,3,99,00000001,The unenlightening phrase ''VGA-EGA Interlock'' appears on the diagram next to this fuse.,"הביטוי מחשיך העיניים ""משלב VGA-EGA"" מופיע על התרשים לצד הנתיך.",,
228.msg-1-0-0-4-,228.msg,1,0,0,4,99,00000001,There is a smudge on the diagram that partially obscures the writing next to this fuse. ''_ower Supply'' is all that's visible of the description.,"כתם על התרשים מסתיר חלקית את הכיתוב ליד הנתיך. ""_ספקת חשמל"" זה כל מה שניתן לראות מהתיאור.",,
228.msg-1-0-0-5-,228.msg,1,0,0,5,99,00000001,The description for this fuse is ''Cockpit Glazing Blemish Removers.'',"תיאור הנתיך הזה הינו ""מסיר כתמי זיגוג בתא הטייס.""",,
228.msg-1-0-0-6-,228.msg,1,0,0,6,99,00000001,The diagram claims this fuse is to the Life Support Systems.,התרשים טוען כי נתיך זה מיועד למערכות תומכות חיים.,,
228.msg-2-1-0-1-,228.msg,2,1,0,1,99,00000001,High Voltage Circuit Fuse.,מפסק זרם במתח גבוה.,,
228.msg-3-0-0-1-,228.msg,3,0,0,1,19,00000001,Oops!,אופס!,,
228.msg-4-0-0-1-,228.msg,4,0,0,1,99,00000001,That fuse doesn't fit there.,הנתיך הזה לא מתאים לשם.,,
228.msg-4-0-1-1-,228.msg,4,0,1,1,99,00000000,"Realizing you've left a good fuse in the wrong socket, you correct your mistake.","בהבינך כי השארת נתיך טוב בשקע שגוי, אתה מתקן את הטעות שלך.",,
230.msg-1-0-0-1-,230.msg,1,0,0,1,19,00000001,What the...?,מה לכל...?,,
230.msg-1-0-0-2-,230.msg,1,0,0,2,19,00000001,Hey! He's a cute little bugger! I think I'll keep him.,הי! הוא ברנש קטן וחמוד! נראה לי שאשמור אותו לעצמי.,,
230.msg-1-0-0-3-,230.msg,1,0,0,3,19,00000001,I'll call him Spike!,אני אקרא לו קוץ!,,
24.msg-1-8-0-1-,24.msg,1,8,0,1,97,00000001,THIS IS THE DETAIL SLIDER ,זהו מחוון הפירוט,,
24.msg-2-8-0-1-,24.msg,2,8,0,1,97,00000001,THIS IS THE GAME CONTROL ABOUT ICON ,זוהי צלמית האודות,,
24.msg-3-8-0-1-,24.msg,3,8,0,1,97,00000001,THIS IS THE GAME CONTROL HELP ICON       ,זוהי צלמית העזרה,,
24.msg-4-8-0-1-,24.msg,4,8,0,1,97,00000001,THIS IS THE GAME CONTROL OK ICON ,זוהי צלמית האישור,,
24.msg-5-8-0-1-,24.msg,5,8,0,1,97,00000001,THIS IS THE GAME CONTROL QUIT ICON ,זוהי צלמית היציאה,,
24.msg-6-8-0-1-,24.msg,6,8,0,1,97,00000001,THIS IS THE GAME CONTROL RESTART ICON ,זוהי צלמית האתחול,,
24.msg-7-8-0-1-,24.msg,7,8,0,1,97,00000001,THIS IS THE GAME CONTROL RESTORE ICON ,זוהי צלמית הטעינה,,
24.msg-8-8-0-1-,24.msg,8,8,0,1,97,00000001,THIS IS THE GAME CONTROL SAVE ICON ,זוהי צלמית השמירה,,
24.msg-9-8-0-1-,24.msg,9,8,0,1,97,00000001,THIS IS THE SPEED SLIDER ,זהו מחוון המהירות,,
24.msg-10-8-0-1-,24.msg,10,8,0,1,97,00000001,THIS IS THE VOLUME SLIDER ,זהו מחוון עוצמת הקול,,
240.msg-1-2-1-1-,240.msg,1,2,1,1,26,00000001,"Ugh. Sorry, I tried to kick your butt back there on the planet, Captain Wilco. I thought you were one of those pukoid mutants.","אהה. מתנצלת, ניסיתי לקרוע אותך שם על הכוכב, קפטן ווילקו. חשבתי שאתה אחד מאותם מוטנטים פיוקואידים.",,
240.msg-1-2-1-2-,240.msg,1,2,1,2,19,00000001,"Call me Roger, and don't worry about it.","קראי לי רוג'ר, ואין לך מה לדאוג.",,
240.msg-1-2-1-3-,240.msg,1,2,1,3,26,00000001,"I don't think I'm going to make it, Roger. One of those bastards nicked me with that awful primordial soup...","אני לא חושבת שאשרוד את זה, רוג'ר. אחד הממזרים פצע אותי עם המרק הקדמוני האיום הזה...",,
240.msg-1-2-1-4-,240.msg,1,2,1,4,19,00000001,"Don't worry, we'll fix you up. There's got to be a cure!","אל דאגה, אנחנו נרפא אותך. חייבת להיות תרופה!",,
240.msg-1-2-1-5-,240.msg,1,2,1,5,26,00000001,I'm afraid not. The only thing you can do is slow down the mutations by putting me into cryogenic suspension.,אני חוששת שלא. הדבר היחיד שאתה יכול לעשות כדי להאט את התפשטות המוטציה הוא להכניס אותי להשהייה קריוגנית.,,
240.msg-1-2-1-6-,240.msg,1,2,1,6,19,00000001,Beatrice! You're asking me to freeze you--and we were getting along so well...,ביאטריס! את מבקשת ממני להקפיא אותך--עד שאנחנו מסתדרים כל כך טוב...,,
240.msg-1-2-1-7-,240.msg,1,2,1,7,26,00000001,"I must admit I thought you were a real putz back at the academy, Roger.","אני חייבת להודות שחשבתי שאתה פוץ אמיתי שם באקדמיה, רוג'ר.",,
240.msg-1-2-1-8-,240.msg,1,2,1,8,26,00000001,But you've turned out to be an OK guy... maybe even more than ok...,אבל התגלית כבחור סבבה לגמרי... אולי אפילו קצת יותר מסבבה...,,
240.msg-1-2-1-9-,240.msg,1,2,1,9,26,00000001,But we don't have any time for that now. I'm probably not going to make it and the Pukoids have to be stopped before they trash the entire Star Confederation.,אבל אין לנו זמן לזה כרגע. אני כנראה לא אשרוד ואת הפיוקואידים חובה לעצור לפני שהם ישמידו את צבר-כוכבא כולו.,,
240.msg-1-2-1-10-,240.msg,1,2,1,10,19,00000001,How? The Goliath could be parsecs away by now! We'll never catch them before they reach StarCon!,איך? הגוליית כבר יכולה להיות במרחק שנות אור! אין סיכוי שנדביק אותם לפני שהם יגיעו לצבר-כוכבא!,,
240.msg-1-2-1-11-,240.msg,1,2,1,11,26,00000001,They aren't going to get far without this. It's the Goliath's warp distributor cap.,הם לא יגיעו רחוק בלי הדבר הזה. זה מכסה מפלג העל-חלל של הגוליית.,,
240.msg-1-2-1-12-,240.msg,1,2,1,12,19,00000001,Bea! You're a genius!,בי! את גאונה!,,
240.msg-1-2-1-13-,240.msg,1,2,1,13,26,00000001,I know... Unnnh... Now put me in the cryo chamber... quickly...,אני יודעת... אהההה... עכשיו שים אותי בתא ההקפאה... מהר...,,
240.msg-1-2-1-14-,240.msg,1,2,1,14,23,00000001,What the... Who's that Cap'n.?,מה לכל... מי זאת קפטן?,,
240.msg-1-2-1-15-,240.msg,1,2,1,15,19,00000001,Ambassador Wankmeister. She escaped from the Goliath. Their entire crew has been infected by some strange substance and are turning into hideous pukoid mutants. We gotta get her stabilized before she turns into one herself. What should I do?,השגרירה וונקמייסטר. היא ברחה מהגוליית. כל אנשי צוותה נגועים בחומר בלתי מזוהה והופכים בזה אחר זה למוטציות פיוקואידיות מבחילות. אנחנו חייבים לייצב את מצבה בטרם תהפוך גם היא לאחת מהם. מה אני אמור לעשות?,,
240.msg-1-2-1-16-,240.msg,1,2,1,16,23,00000001,"I'm an engineer, not a doctor! |f8|you|f| better do something quick though, sir. She's starting to look a little green around the gills.","אני מהנדס, לא רופא! כדאי שתעשה משהו ומהר, המפקד. היא מתחילה להיראות טיפה ירוקה באזור הזימים.",,
240.msg-2-0-2-1-,240.msg,2,0,2,1,99,00000001,"She's really going to pieces for you, Rog.","הלב שלה באמת נשבר לחתיכות, רוג'.",,
240.msg-2-1-0-1-,240.msg,2,1,0,1,99,00000001,Looks as though Ambassador Wankmeister is having a ''bad hair day.'',נראה שעובר על השגרירה וונקמייסטר יום מסובך עם השיער.,,
240.msg-2-2-3-1-,240.msg,2,2,3,1,26,00000001,Whew! I'm glad to get out of there. How come all those pretty lights are flashing? What's going on?,וואו! אני שמחה לצאת משם. איך זה שכל האורות היפים האלה מהבהבים? מה הולך פה?,,
240.msg-2-2-3-2-,240.msg,2,2,3,2,19,00000001,Not much... Except that the Eureka has sucked up a giant pukoid blob creature and is about to self-destruct.,לא הרבה... חוץ מזה שהיוריקה שאבה גוש יצור גושי פיוקואידי והיא מתכוננת להשמדה עצמית.,,
240.msg-2-2-3-3-,240.msg,2,2,3,3,26,00000001,That's nice...,זה נחמד...,,
240.msg-2-2-3-4-,240.msg,2,2,3,4,19,00000001,"I think you're still a bit woozy, Bea.","אני חושב שאת עדיין טיפה מסוחררת, בי.",,
240.msg-2-2-3-5-,240.msg,2,2,3,5,26,00000001,"Whatever you say, dear.","מה שתגיד, יקירי.",,
240.msg-2-2-56-1-,240.msg,2,2,56,1,26,00000001,Thanks for letting me out of there Robert.,תודה שחילצת אותי משם רוברט.,,
240.msg-2-2-56-2-,240.msg,2,2,56,2,19,00000001,"I think you're still a bit woozy, Bea.","אני חושב שאת עדיין טיפה מסוחררת, בי.",,
240.msg-2-2-56-3-,240.msg,2,2,56,3,26,00000001,"Whatever you say, Reggie.","מה שתגיד, רג'י.",,
240.msg-2-2-4-1-,240.msg,2,2,4,1,19,00000001,I'm not sure if the transporter is working right. You better go first Bea.,אני לא בטוח עד כמה המשגר הזה תקין. כדאי שתהיי ראשונה בי.,,
240.msg-2-2-4-2-,240.msg,2,2,4,2,26,00000001,"Oh Roger, you're so self-sacrificing.","הו רוג'ר, אתה כזה אמיץ ונדיב.",,
240.msg-2-2-4-3-,240.msg,2,2,4,3,19,00000001,Good. She didn't get killed. I guess the transporter checks out.,יופי. היא לא נהרגה. אני מניח שהמשגר עבר את הבדיקה בהצלחה.,,
240.msg-3-1-0-1-,240.msg,3,1,0,1,99,00000001,"Bea hovers on the verge of consciousness, her body wracked with agony from the grazing hit by the pukoid phlegm thrower.","בי מרחפת על סף התודעה, גופתה מתעוותת בייסורים מהפגיעה הבוערת של מטול הליחה הפיוקואידי.",,
240.msg-3-2-0-1-,240.msg,3,2,0,1,99,00000001,Bea doesn't feel like talking right now.,בי לא מרגישה צורך לדבר כרגע.,,
240.msg-4-1-58-1-,240.msg,4,1,58,1,99,00000001,Bea just stands there with a dazed look on her face. It's obvious the struggle against the slime has taken a toll on her mentally as well as physically.,בי רק עומדת שם עם מבט המום על פניה. זה ברור שהמאבק נגד הריר גבה ממנה מחיר כבד מנטלית ופיזית.,,
240.msg-4-1-0-1-,240.msg,4,1,0,1,99,00000001,"Although Bea has been cured from the mutations, the struggle against the pukoid slime has left her fragile and weak.","למרות שבי החלימה מהמוטציה, המאבק נגד הריר הפיוקואידי הותיר אותה שברירית וחלשה.",,
240.msg-4-1-46-1-,240.msg,4,1,46,1,99,04013a01,,,,
240.msg-4-2-58-1-,240.msg,4,2,58,1,99,00000001,"C'mon Ronald, let's get going; I'm late for my nail appointment.","קדימה רונלד, בוא נזוז; אני מאחרת לתור לציפורניים.",,
240.msg-4-2-46-1-,240.msg,4,2,46,1,99,00000001,"Are we there yet, Reggie?","הגענו כבר, רג'י?",,
240.msg-5-0-42-1-,240.msg,5,0,42,1,23,00000001,"Hey Cap'n, those tanks generally work a whole lot better if you keep the lid shut.","הי קפטן, המיכלים האלה בדרך כלל עובדים הרבה יותר טוב אם שומרים על המכסה סגור.",,
240.msg-5-0-43-1-,240.msg,5,0,43,1,23,00000001,"Please do something about that critter of yours, Captain. I can't keep fixing the holes in the hull forever.","בבקשה תעשה משהו עם היצור שלך, קפטן. אני לא יכול לסתום את החורים בספינה לנצח.",,
240.msg-5-24-0-1-,240.msg,5,24,0,1,23,00000001,"Yeah, sure, Cap'n. I'll get right on it.","כן, ברור, קפטן. אני כבר מטפל בזה.",,
240.msg-5-4-0-1-,240.msg,5,4,0,1,23,00000001,"Keep yer hands to yerself, sir.","שמור את הידיים שלך לעצמך, המפקד.",,
240.msg-5-1-5-1-,240.msg,5,1,5,1,23,00000001,Cliffy is looking at you expectantly.,צוקי מביט בך בציפייה.,,
240.msg-5-1-53-1-,240.msg,5,1,53,1,99,00000001,"Its your chief (and only) engineer Cliffy, hard at work making general adjustments and repairs to one of the Eureka's many complex and delicate control systems. ","המהנדס הראשי (והיחידי) שלך צוקי, עובד קשה על כיוונונים כלליים ותיקונים באחת ממערכות השליטה המסובכות והעדינות הרבות של היוריקה.",,
240.msg-5-1-6-1-,240.msg,5,1,6,1,99,00000001,Cliffy's hard at work repairing the android.,צוקי שקוע בשיפוץ האנדרואידית.,,
240.msg-5-2-0-1-,240.msg,5,2,0,1,99,00000001,Cliffy is too engrossed in what he's doing to talk to you.,צוקי כל כך שקוע במה שהוא עושה עד שאינו מסוגל לשוחח איתך.,,
240.msg-5-2-7-1-,240.msg,5,2,7,1,23,00000001,"Wait up, Cap'n. I'll go with ya.","חכה לי, קפטן. אני בא איתך.",,
240.msg-5-2-51-1-,240.msg,5,2,51,1,23,00000001,"Shouldn't you be going, sir? There's no sense in making the rest us suffer for your mistakes.","אתה לא אמור ללכת, המפקד? אין סיבה שכולנו נסבול מהטעויות שלך.",,
240.msg-5-2-8-1-,240.msg,5,2,8,1,99,00000001,"C'mon kimosabe, let's hop to it.","קדימה קודקוד, בוא נטפל בזה.",,
240.msg-5-2-5-1-,240.msg,5,2,5,1,23,00000001,"I think we should try an figure out a cure for the ambassador, Cap'n. There'll be you know what to pay if she croaks on us.","אני חושב שכדאי שננסה למצוא תרופה לשגרירה, קפטן. אנחנו נסתבך רציני אם היא תתפגר במשמרת שלנו.",,
240.msg-5-2-9-1-,240.msg,5,2,9,1,99,00000001,"Where'd ya run off to, chief? The ambassador's gettin' kinda ripe--we need to come up with something pronto.","לאן אתה בורח, בוס? השגרירה מתחילה להבשיל--כדאי שנחשוב על משהו בדחיפות.",,
240.msg-5-2-10-1-,240.msg,5,2,10,1,99,00000001,The transporter is ready to go sir. Put the ambassador on it and I'll make a few delicate adjustments.,המשגר מוכן לפעולה המפקד. שים עליו את השגרירה ואני אעשה כמה כוונונים עדינים.,,
240.msg-5-2-52-1-,240.msg,5,2,52,1,23,00000001,What in tarnation is going on sir?! Who locked a tractor beam onto us?,מה לכל השדים קורה פה המפקד?! מי נעל עלינו קרן גרירה?,,
240.msg-5-2-52-2-,240.msg,5,2,52,2,19,00000001,"An annihilator android is after me for something I did a long, long time ago, Cliffy. She's threatening to blow the ship up if I don't beam down to the surface.","אנדרואידית משמידה רודפת אחרי בגלל משהו שעשיתי לפני המון המון זמן, צוקי. היא מאיימת לפוצץ את הספינה אם לא אשתגר מטה אל פני השטח.",,
240.msg-5-2-52-3-,240.msg,5,2,52,3,23,00000001,"What'd you do sir, inhale?","מה עשית המפקד, נשמת?",,
240.msg-5-2-52-4-,240.msg,5,2,52,4,19,00000001,"No, nothing like that. I ordered something through the mail and I forgot to pay for it.","לא, לא משהו כזה. הזמנתי משהו בדואר ושכחתי לשלם עליו.",,
240.msg-5-2-52-5-,240.msg,5,2,52,5,23,00000001,"Mail fraud is a very serious crime, Cap'n. I wish you luck.","הונאת דואר זהו פשע חמור ביותר, קפטן. שיהיה לך בהצלחה.",,
240.msg-6-1-0-1-,240.msg,6,1,0,1,99,00000001,It would seem Bea is anxious to exit the chamber.,נראה שבי להוטה לצאת מהתא.,,
240.msg-7-4-11-1-,240.msg,7,4,11,1,99,00000001,Opening the chamber would not be prudent at this juncture.,פתיחת התא לא תהיה צעד נבון בשלב הזה.,,
240.msg-7-4-8-1-,240.msg,7,4,8,1,99,00000001,"Not now. You better figure out what your 'lil buddy spike is trying to tell you, first.",לא עכשיו. קודם כל תנסה להבין מה הקטנצ'יק שלך קוץ מנסה להגיד לך.,,
240.msg-7-1-0-1-,240.msg,7,1,0,1,99,00000001,Bea's primordial soup infested body lies frozen in the cryo chamber like an ambassador-cicle.,גופתה נגועת המרק הקדמוני של בי שוכבת קפואה בתא הקירור כמו שלגון-שגריר.,,
240.msg-8-4-0-1-,240.msg,8,4,0,1,99,00000001,Bea still needs some time to rest and recuperate from her ordeal.,בי צריכה קצת לנוח כדי להתאושש מהחוויה הקשה.,,
240.msg-8-1-0-1-,240.msg,8,1,0,1,99,00000001,Bea is currently spending some quality time recuperating in the cryo.,בי מבלה זמן איכות בהתאוששות בתא ההקפאה.,,
240.msg-9-1-0-1-,240.msg,9,1,0,1,99,00000001,This button extends and retracts the cryo chamber from its storage location behind the bulkhead.,כפתור זה פותח ומקפל את תא ההקפאה ממקום האחסון שלו מאחורי המחיצה.,,
240.msg-10-1-0-1-,240.msg,10,1,0,1,99,00000001,This chamber houses the Eureka's cryogenic cooler. Cliffy uses it to keep his Kerona Lite chilled to a frosty 4 degrees Kelvin when it is not otherwise occupied.,תא זה מאכלס את המקרר הקריוגני. צוקי משתמש בו לקירור משקה הקרונה דיאט שלו ל-4 מעלות קלווין כשהוא לא תפוס במשהו אחר.,,
240.msg-11-4-12-1-,240.msg,11,4,12,1,99,00000001,You don't want to close the chamber yet. Trust us.,אתה לא רוצה לסגור עדיין את התא. סמוך עלינו.,,
240.msg-11-4-11-1-,240.msg,11,4,11,1,99,00000001,There's no need to open the cryo chamber now.,אין צורך לפתוח כרגע את תא ההקפאה.,,
240.msg-11-4-13-1-,240.msg,11,4,13,1,99,00000001,Try opening the chamber without Bea in your hands. Your efforts will meet with greater success.,נסה לפתוח את התא כשבי אינה בזרועותיך. מאמציך יקצרו הצלחות גדולות יותר.,,
240.msg-11-1-0-1-,240.msg,11,1,0,1,99,00000001,The cryo chamber is currently unoccupied.,תא ההקפאה אינו מאוכלס בשעה זו.,,
240.msg-11-1-13-1-,240.msg,11,1,13,1,99,00000001,You have your hands full right now. Try putting Bea down first.,הידיים שלך תפוסות כרגע. נסה תחילה להניח את בי.,,
240.msg-12-1-0-1-,240.msg,12,1,0,1,99,00000001,This is the CryoChef 12 Climactic Climate Control Cooler. It can freeze a tomato solid in 5 seconds and make it explode in 10.,לפנינו מקרר בקרת אקלים מדופלם מדגם מקפישף 12. הוא יכול להקפיא עגבניה מוצקת ב-5 שניות ולגרום לה להתפוצץ ב-10 שניות.,,
