file-noun-verb-condition-sequence-,file,noun,verb,condition,sequence,talker,padding,text,translation,comment_padding,comment_text
0.msg-1-5-0-1-,0.msg,1,5,0,1,99,00000001,Press this button for information about Space Quest 5. ,לחצו על מקש זה לקבלת מידע על מסע בחלל 5.,,
0.msg-1-1-0-1-,0.msg,1,1,0,1,99,00000001,Space Quest 5: The Next Mutation Version: %s ,מסע בחלל 5: המוטציה הבאה גרסה: %s ,,
0.msg-1-1-0-2-,0.msg,1,1,0,2,99,00000001,"If you think SPACE QUEST 5: The Next Mutation is a real hoot, you ought to check out some of Roger Wilco's other spaced out adventures. Read the ''Technobable'' at the start of the game for ordering information.","אם נהניתם מאד ממסע בחלל 5: המוטציה הבאה, כדאי לכם לבדוק עוד כמה מהרפתקאות החלל של רוג'ר ווילקו. קראו את ""הפרטים הטכניים היבשים"" בתחילת המשחק לקבלת מידע נוסף.",,
0.msg-0-24-0-1-,0.msg,0,24,0,1,99,00000001,Your attempts to take command of the situation do not meet with success.,נסיונותיך לקחת פיקוד על הסיטואציה לא עלו יפה.,,
0.msg-0-7-0-1-,0.msg,0,7,0,1,99,00000001,Those items won't work together. ,חפצים אלו אינם עובדים יחד.,,
0.msg-0-7-0-2-,0.msg,0,7,0,2,99,00000001,That's an interesting idea. ,זה רעיון מעניין.,,
0.msg-0-7-0-3-,0.msg,0,7,0,3,99,00000001,That's not necessary.  ,זה לא הכרחי.,,
0.msg-0-4-0-1-,0.msg,0,4,0,1,99,00000001,That will not be of any help. ,זה לא יעזור בכלום.,,
0.msg-0-4-0-2-,0.msg,0,4,0,2,99,00000001,Not here.,לא כאן.,,
0.msg-0-2-0-1-,0.msg,0,2,0,1,99,00000001,It's not unlike talking to a brick wall.,אין זה שונה מלדבר עם קיר לבנים.,,
0.msg-0-2-0-2-,0.msg,0,2,0,2,99,00000001,And just what do you expect it to say to you?,ומה בדיוק ציפית שהוא יגיד?,,
0.msg-2-5-0-1-,0.msg,2,5,0,1,99,00000001,Use this icon to give an order to your crew.,השתמשו בצלמית זו כדי לחלק פקודות לצוות.,,
0.msg-3-5-0-1-,0.msg,3,5,0,1,99,00000001,"Select this icon to adjust the game's sound, detail level, Roger's movement speed, or to save, restore, or quit a game.   ","בחרו בצלמית זו על מנת לכוונן את הקול במשחק, רמת הפירוט, מהירות התנועה של רוג'ר, או לשמור, לטעון, ולצאת מהמשחק.",,
0.msg-4-5-0-1-,0.msg,4,5,0,1,99,00000001,This is Roger's currently selected inventory item.  ,זה פריט המלאי שנבחר כרגע על ידי רוג'ר.,,
0.msg-5-5-0-1-,0.msg,5,5,0,1,99,00000001,Use this to reduce animation and speed-up play if the game is running too slow on your machine.,השתמשו בזה לשנמוך רמת ההנפשה וההאצה במידה והמשחק פועל באיטיות רבה מדי על המחשב שלכם.,,
0.msg-6-5-0-1-,0.msg,6,5,0,1,99,00000001,Select this icon to manipulate objects or to pick up items.    ,בחרו בצלמית זו כדי לתפעל עצמים או להרים חפצים.,,
0.msg-7-5-0-1-,0.msg,7,5,0,1,99,00000001,This is the help icon. Move this over other icons to see what they do.,זוהי צלמית העזרה. רחפו איתה מעל צלמיות אחרות כדי ללמוד על פעולתן.,,
0.msg-8-1-0-1-,0.msg,8,1,0,1,99,00000001,Play New Game,משחק חדש,,
0.msg-8-1-0-2-,0.msg,8,1,0,2,99,00000001,Restore Old Game,טעינת משחק,,
0.msg-8-1-0-3-,0.msg,8,1,0,3,99,00000001,Quit,יציאה,,
0.msg-8-1-0-4-,0.msg,8,1,0,4,99,00000001,|f5|Space Quest 5:,|f5| מסע בחלל 5:,,
0.msg-8-1-0-5-,0.msg,8,1,0,5,99,00000001,|f5|The Next Mutation,|f5| המוטציה הבאה,,
0.msg-8-1-0-6-,0.msg,8,1,0,6,99,00000001,See Introduction,צפו בהקדמה,,
0.msg-8-1-0-7-,0.msg,8,1,0,7,99,00000001,Read Technobabble,קראו פרטים טכניים יבשים,,
0.msg-9-5-0-1-,0.msg,9,5,0,1,99,00000001,Use this icon to manipulate an inventory item.,השתמשו בצלמית זו לתפעול פריטי המלאי.,,
0.msg-10-5-0-1-,0.msg,10,5,0,1,99,00000001,Click on this to see the items in your inventory.,הקישו על זה כדי לראות את הפריטים שבמלאי.,,
0.msg-11-5-0-1-,0.msg,11,5,0,1,99,00000001,This the help icon. Move it over other icons to see what they do. ,זוהי צלמית העזרה. רחפו איתה מעל צלמיות אחרות כדי ללמוד על פעולתן.,,
0.msg-12-5-0-1-,0.msg,12,5,0,1,99,00000001,Use this icon to select one of the inventory items.,השתמשו בצלמית זו כדי לבחור באחד מפריטי המלאי.,,
0.msg-13-5-0-1-,0.msg,13,5,0,1,99,00000001,Use this icon to get a closer look and description of an inventory item.,השתמשו בצלמית זו לבחינה מקרוב ולקבלת תיאור מדוקדק על פריטים מהמלאי.,,
0.msg-14-5-0-1-,0.msg,14,5,0,1,99,00000001,Use this icon when you are ready to return to the game.,השתמשו בצלמית זו כאשר אתם מרגישים מוכנים לחזור לשחק.,,
0.msg-15-5-0-1-,0.msg,15,5,0,1,99,00000001,Use this icon to select one of the available inventory items.,השתמשו בצלמית זו כדי לבחור באחד מפריטי המלאי הזמינים.,,
0.msg-16-5-0-1-,0.msg,16,5,0,1,99,00000001,Use this icon to examine things in the area.  ,השתמשו בצלמית זו לבחינת החפצים בסביבה.,,
0.msg-17-5-0-1-,0.msg,17,5,0,1,99,00000001,Return to the game. ,חזרה למשחק.,,
0.msg-18-0-1-1-,0.msg,18,0,1,1,99,00000001,OUT OF,מתוך,,
0.msg-19-5-0-1-,0.msg,19,5,0,1,99,00000001,Use this icon to quit the game.,השתמשו בצלמית זו ליציאה מהמשחק.,,
0.msg-19-1-0-1-,0.msg,19,1,0,1,99,00000001,Are You Sure?,אתם בטוחים?,,
0.msg-19-1-0-2-,0.msg,19,1,0,2,99,00000001,YES,כן,,
0.msg-19-1-0-3-,0.msg,19,1,0,3,99,00000001,NO,לא,,
0.msg-19-1-0-4-,0.msg,19,1,0,4,99,00000001,"Thank You for Playing:

  |f5|Space Quest 5: 

The Next Mutation","תודה ששיחקתם:

מסע בחלל 5:

המוטציה הבאה",,
0.msg-20-5-0-1-,0.msg,20,5,0,1,99,00000001,Start the game at the beginning.,התחלת משחק מחדש.,,
0.msg-20-1-0-1-,0.msg,20,1,0,1,99,00000001,Are you sure you want to restart?,אתם רוצים לאתחל בוודאות?,,
0.msg-20-1-0-2-,0.msg,20,1,0,2,99,00000001,Yes,כן,,
0.msg-20-1-0-3-,0.msg,20,1,0,3,99,00000001,No,לא,,
0.msg-21-5-0-1-,0.msg,21,5,0,1,99,00000001,Restore a game.  ,טעינת משחק.,,
0.msg-30-1-0-1-,0.msg,30,1,0,1,99,00000001,"Looks like there's a fly in the ointment, and that fly is you.","נראה שיש זבוב במרק, והזבוב הזה הוא אתה.",,
0.msg-30-1-0-2-,0.msg,30,1,0,2,99,00000001,"You've been mistaken for a household pest before, but this is getting a bit ridiculous.","כבר נחשבת בעבר בטעות למזיק בלתי רצוי, אבל זה מתחיל להיות מגוחך.",,
0.msg-22-0-0-1-,0.msg,22,0,0,1,99,00000001,That's not something you need to do.,זה לא משהו שאתה אמור לעשות.,,
0.msg-22-0-0-2-,0.msg,22,0,0,2,99,00000001,Just exactly where did you think that would fit? ,לאיפה בדיוק אתה חושב שזה יתאים?,,
0.msg-22-0-0-3-,0.msg,22,0,0,3,99,00000001,Not now. ,לא עכשיו.,,
0.msg-22-17-0-1-,0.msg,22,17,0,1,99,00000001,"Money doesn't matter tonight, Rog.","כסף לא חשוב הלילה, רוג'.",,
0.msg-22-24-0-1-,0.msg,22,24,0,1,99,00000001,"Trying to order yourself around? Pretty weird, if you ask me. But then, hey, what do I know? I'm just the narrator.","מנסה לתת לעצמך פקודות ריקות? די מוזר, אם אתה שואל אותי. אבל, הי, מה אני יודע? אני רק הקריין.",,
0.msg-22-32-0-1-,0.msg,22,32,0,1,99,00000001,That's not necessary now.,זה לא נחוץ כרגע.,,
0.msg-22-7-0-1-,0.msg,22,7,0,1,99,00000001,What?,מה?,,
0.msg-22-19-0-1-,0.msg,22,19,0,1,99,00000001,Don't be ridiculous.,אל תהיה מגוחך.,,
0.msg-22-4-0-1-,0.msg,22,4,0,1,99,00000001,You tug at your clothing to achieve a slightly more comfortable fit.,אתה מושך בבגדיך כדי להשיג התאמה מעט נוחה יותר.,,
0.msg-22-4-0-2-,0.msg,22,4,0,2,99,00000001,Hey cut it out--this is a family game.,הי מספיק עם זה--זה משחק משפחתי.,,
0.msg-22-41-0-1-,0.msg,22,41,0,1,99,00000001,"It's cute, but I don't think it's your color.","זה חמוד, אבל לא הצבע שלך לדעתי.",,
0.msg-22-21-0-1-,0.msg,22,21,0,1,99,00000001,Don't do that. You don't know where it's been. ,אל תעשה את זה. אין לך מושג איפה זה היה.,,
0.msg-22-22-0-1-,0.msg,22,22,0,1,99,00000001,You seem to recall sampling this fruit as a child. It left you constipated for days. You opt not to eat it. ,אתה נזכר שדגמת מהפרי הזה בתור ילד. לאחר מכן סבלת מעצירות במשך ימים. אתה בוחר שלא לאכול אותו.,,
0.msg-22-1-0-1-,0.msg,22,1,0,1,99,00000001,"It's you, Roger Wilco, wacky space guy.","זה אתה, רוג'ר ווילקו, איש חלל מטורלל.",,
0.msg-22-1-0-2-,0.msg,22,1,0,2,99,00000001,"It's you, Roger Wilco, Space hero extraordinaire (cough, cough).  ","זה אתה, רוג'ר ווילקו, גיבור חלל יוצא מן הכלל (שיעול, שיעול).",,
0.msg-22-39-0-1-,0.msg,22,39,0,1,99,00000001,The mask is only effective for a limited time. Don't use it unless you really need it.,המסיכה אפקטיבית לזמן מוגבל בלבד. אל תשתמש בה כל עוד אתה לא באמת צריך.,,
0.msg-22-25-0-1-,0.msg,22,25,0,1,99,00000001,Not bloody likely. ,אין סיכוי בעולם.,,
0.msg-22-20-0-1-,0.msg,22,20,0,1,99,00000001,And just what do you think you're going to do with them? Wear the cones like a day-glo dunce cap? ,ומה בדיוק אתה חושב שאתה הולך לעשות איתם? לחבוש את החרוטים כמו כובע טמבל עם נצנצים?,,
0.msg-22-18-0-1-,0.msg,22,18,0,1,99,00000001,"Although your personal hygiene could stand improvement, that certainly isn't the way to go about it.","למרות שבהיגיינה האישית שלך יש בהחלט מקום לשיפור, זו בפירוש לא הדרך לעשות את זה.",,
0.msg-22-2-0-1-,0.msg,22,2,0,1,99,00000001,You can't understand what you're saying.,קרוב לודאי שאתה לא מבין מה אתה אומר.,,
0.msg-22-2-0-2-,0.msg,22,2,0,2,99,00000001,Talking to yourself isn't helpful.,שיחות עם עצמך אינן מועילות.,,
0.msg-23-5-0-1-,0.msg,23,5,0,1,99,00000001,Save your current game.,שמירת משחק נוכחי.,,
0.msg-24-5-0-1-,0.msg,24,5,0,1,99,00000001,Use this to adjust the sound level.,השתמש בזה לכוונון רמת הצליל.,,
0.msg-25-5-0-1-,0.msg,25,5,0,1,99,00000001,Use this to control the speed of Roger's movement. ,השתמש בזה לשליטה על מהירות תנועתו של רוג'ר.,,
0.msg-29-0-0-1-,0.msg,29,0,0,1,99,00000001,SPACE QUEST 5: The Next Mutation                     Score:,מסע בחלל 5: המוטציה הבאה                     ניקוד:,,
0.msg-26-5-0-1-,0.msg,26,5,0,1,99,00000001,Select this icon to talk with other people in the area.  ,בחר בצלמית זו לשיחה עם אנשים בסביבתך.,,
0.msg-27-0-0-1-,0.msg,27,0,0,1,99,00000001,Welcome to Space Quest V. Choose one of the following:,ברוך הבא למסע בחלל 5. בחר אחת מהאפשרויות הבאות:,,
0.msg-28-5-0-1-,0.msg,28,5,0,1,99,00000001,Use this icon to move Roger around.  ,השתמש בצלמית זו להנעת רוג'ר ממקום למקום.,,
1.msg-1-1-0-1-,1.msg,1,1,0,1,99,00000001,"It's you, Roger Wilco, a wacky, spaced-out adventurer.","זה אתה, רוג'ר ווילקו, הרפתקן על-חלל תמהוני.",,
1.msg-1-2-0-1-,1.msg,1,2,0,1,99,00000001,You can't understand what you're saying.,אתה לא מבין מה אתה אומר.,,
1.msg-1-4-0-1-,1.msg,1,4,0,1,99,00000001,Hey cut it out--this is a family game.,הי צנזר את זה--זה משחק משפחתי.,,
100.msg-1-0-0-1-,100.msg,1,0,0,1,99,00000001,"|c5|Sales Order Information|c|



To place a domestic order with Sierra On-Line, call (800) 326-6654 from 7:00 a.m. through 7:00 p.m. Pacific Time, Monday through Friday, for convenient, person-to-person service; or if you prefer, you may place your order via Fax (209) 683-4297 (Please include your name, address, phone number, credit card number and expiration date).",,,
100.msg-1-0-0-2-,100.msg,1,0,0,2,99,00000001,"To place an international order with our Sierra On-Line U.K. Sales Office, call [0]734-303171 for convenient, person-to-person service, or Fax in your order to [0]734 303201.  You can also place your international order with our U.S. office at (209) 683-4468 or Fax in your order to (209) 683-4297.",,,
100.msg-1-0-0-3-,100.msg,1,0,0,3,99,00000001,"|c5|Hints|c|

 

Game hints are available by phone, hint books (orders available through the Sierra Sales Department), through the Sierra Bulletin Board Service (209-683-4463), or by mail (P.O. Box 200, Coarsegold, CA  93614-0200, Attn: Hint Department).  If you want an immediate response, you can call our 24-hour automated Hint Line at 900-370-5583 in the U.S.  In the U.K., call (0)734 304004.",,,
100.msg-1-0-0-4-,100.msg,1,0,0,4,99,00000001,U.S. users will be charged $.75 per minute.  Long distance charges are included in the fee.  U.K. customers will be charged the normal rate for U.K. telephone calls.  Callers under the age of 18 must get their parent's permission before calling the hint line.  |c1|ABSOLUTELY NO HINTS WILL BE PROVIDED THROUGH OUR CUSTOMER SUPPORT LINES!|c|,,,
100.msg-1-0-0-5-,100.msg,1,0,0,5,99,00000001,"At this time, the automated hint system is only available within the United States.  All contents are copyrighted by Sierra On-Line and may not be reproduced in any form without express written permission.",,,
100.msg-1-0-0-6-,100.msg,1,0,0,6,99,00000001,"|c5|Quick Trouble Shooting Tips|c|

 

1.  Use the Install program to create a Boot Disk, and then use this disk to boot your system and run the game.

",,,
100.msg-1-0-0-7-,100.msg,1,0,0,7,99,00000001,"2.  If you are experiencing any form of program hesitation or lockups during game play and are using a Sound Blaster or compatible sound card, the following information is a temporary solution to have you up and running quickly.",,,
100.msg-1-0-0-8-,100.msg,1,0,0,8,99,00000001,"For Sound Blaster or compatible sound card users, run the install procedure from the game sub-directory and select the ''Adlib'' or ''PC Internal Speaker'' option for music and select ''No Audio/Speech Card'' for speech where applicable. ",,,
100.msg-1-0-0-9-,100.msg,1,0,0,9,99,00000001,"Please Note:  This temporary solution does not give you the option to hear the sampled sounds or the speech that may be available in your game.  For correct sound card functionality, a call to Sierra On-Line's Technical support or your sound card manufacturer's Technical Support is recommended.",,,
100.msg-1-0-0-10-,100.msg,1,0,0,10,99,00000001,"3.  If you are currently using the PS/1 option for speech and are encountering program hesitation or lockups during game play, run the install procedure from the game sub-directory and select ''No Audio/Speech Card'' for speech where applicable.",,,
100.msg-1-0-0-11-,100.msg,1,0,0,11,99,00000001,"4.  If applicable, select ''Do Not Use Extended Memory'' for the memory option.



If the problem continues, call or fax Sierra Technical Support Tel: (209) 683-8989 Fax:  (209) 683-3633. ",,,
100.msg-1-0-0-12-,100.msg,1,0,0,12,99,00000001,"|c5|Answers To Our Most Frequently Asked Technical Questions|c|

 

Answers to our most frequently asked technical questions are available by calling our Technical Support Line at (209) 683-8989 and pressing 2 on your touch tone telephone.  If your specific issue is not addressed, an option to speak to a Technical Support Representative will be available.  ",,,
100.msg-1-0-0-13-,100.msg,1,0,0,13,99,00000001,"Answers to our most frequently asked technical questions are also available through our Sierra BBS.  At the main menu, select option ''8'' for Technical Help and then select ''T'' for Top 10 Technical Issues.",,,
100.msg-1-0-0-14-,100.msg,1,0,0,14,99,00000001,"|c5|Technical Help|c|

 

Technical assistance is only a telephone call away.  Call (209) 683-8989 for convenient, person-to-person service, or if you prefer, you may request assistance by fax (209) 683-3633 or mail.",,,
100.msg-1-0-0-15-,100.msg,1,0,0,15,99,00000001,"If you choose to write us with your request, please give us detailed information on both your computer system and the nature of your problem.  In addition, please include your address and telephone number should we need further information.",,,
100.msg-1-0-0-16-,100.msg,1,0,0,16,99,00000001,"Send to:  



 Sierra On-Line

 P.O. Box 800

 Coarsegold, CA  93614-0800

 Attention:  Technical Support",,,
100.msg-1-0-0-17-,100.msg,1,0,0,17,99,00000001,"Sierra Technical Support is also available through:



 Sierra BBS - (209) 683-4463

 Compuserve - Gamapub Forum

 Prodigy - WBWW55A (Tech. Support ID)

 America's On-Line

 Genie",,,
100.msg-1-0-0-18-,100.msg,1,0,0,18,99,00000001,"|c5|The Sierra no risk guarantee!|c|



If you find that you need to send for replacement diskettes, send the original disk #1 in the size you need (3.5'' or 5.25'') to:



U.S. Customers

 Sierra On-Line

 P.O. Box 485

 Coarsegold, CA 93614

 Attention: Returns",,,
100.msg-1-0-0-19-,100.msg,1,0,0,19,99,00000001,"U.K. Customers

 Sierra On-Line Limited

 Attn: Returns

 Unit 2, Theale Technology Centre,

 Theale, Berkshire RG7 4AA

United Kingdom",,,
100.msg-1-0-0-20-,100.msg,1,0,0,20,99,00000001,"Be sure to include a note stating your computer type, and the size of diskettes you need (5.25'' or 3.5'').  We will gladly replace your program free of charge for the first 90 days of ownership (please enclose a copy of your dated sales receipt with your request).  After 90 days there is a $10.00 (L6.00) charge for 5.25'' or 3.5'' diskettes.",,,
100.msg-1-0-0-21-,100.msg,1,0,0,21,99,00000001,"|c5|The promise|c|:  We want you to be happy with every Sierra product you purchase from us.  Period.  If for any reason you're unhappy with the product, return it within 30 days for an exchange or a full refund... |c1|even if you bought it retail!!|c|  (Hardware ordered direct must be returned within 10 days.)",,,
100.msg-1-0-0-22-,100.msg,1,0,0,22,99,00000001,"|c5|The only catch:|c|  You gotta tell us why you don't like it. Otherwise we'll never get better. Send it back to us and we promise we'll make things right. (If you bought it at a retail outlet, please send your original sales receipt).",,,
1000.msg-1-1-0-1-,1000.msg,1,1,0,1,99,00000001,This circular device is the starburator for the Goliath's warp drive.,המכשיר העגול הזה הוא הכוכבורטור של מנוע העל-חלל הגולייתי.,,
1000.msg-2-1-0-1-,1000.msg,2,1,0,1,99,00000001,"A tritanium catwalk rings the massive star drive, allowing technicians to perform necessary maintenance functions.","מסלול טריטניום סובב את מנוע הכוכבים המסיבי, ומאפשר לטכנאים לבצע פעולות אחזקה שוטפות.",,
1000.msg-3-1-0-1-,1000.msg,3,1,0,1,99,00000001,A hatchway provides access through the bulkhead at the far end of the engine bay.,צוהר מספק גישה מבעד למחיצה בקצהו הרחוק של רציף התיקונים.,,
1000.msg-4-1-0-1-,1000.msg,4,1,0,1,99,00000001,The Goliath's state of the art star drive can propel it at velocities greater than 10 times the speed of light--which can make for a heinously expensive speeding ticket.,מנוע הכוכבים המתקדם של הגוליית מניע אותה במהירויות של פי 10 ויותר ממהירות האור--מה שעלול לסכן אותה בקנסות גבוהים על מהירות מופרזת.,,
1000.msg-5-4-1-1-,1000.msg,5,4,1,1,99,00000001,You can't reach anything on the panel from where you're standing.,אתה לא יכול להגיע לשום דבר על הלוח מאיפה שאתה עומד.,,
1000.msg-5-1-0-1-,1000.msg,5,1,0,1,99,00000001,"This panel controls critical drive operations, including electrical functions.","לוח הבקרה שולט על פעילוית הנעה חיוניות, כולל התפקודים האלקטרוניים.",,
1000.msg-6-3-0-1-,1000.msg,6,3,0,1,99,00000001,"You knew this was a one way trip the moment you stepped into the EVA pod, Roger. There's no turning back now.","ידעת שזה כרטיס טיסה חד כיווני מהרגע שדרכת לראשונה על רכב החלל, רוג'ר. אין דרך חזור.",,
1000.msg-7-1-0-1-,1000.msg,7,1,0,1,99,00000001,A lone pukoid patrols the catwalks of the engine room. Yuck! It's uglier than your Great Aunt Helga!,פיוקואיד בודד מפטרל במסלולי חדר המנועים. איכס! הוא יותר מכוער מאשר דודה רבא הלגה!,,
1000.msg-8-1-0-1-,1000.msg,8,1,0,1,99,00000001,"The Goliath's drive bay houses a shevy small-block Star Reamer Warp Drive, capable of generating the equivalent of 350 Trillion newtons of thrust energy.","תא המנועים של הגוליית מאכלס מנוע על-חלל מחורר כוכבים בנפח בלוק קטן של שברולט, המסוגל לייצר שווה ערך ל-350 טריליון ניוטונים של אנרגיית דחף.",,
1001.msg-1-0-0-1-,1001.msg,1,0,0,1,99,00000001,"|f1|Beep, Beep.","|f1|ביפ, ביפ.",,
1001.msg-1-0-0-2-,1001.msg,1,0,0,2,99,00000001,|f8|Beep! Beep!,|f8|ביפ! ביפ!,,
1001.msg-2-1-0-1-,1001.msg,2,1,0,1,99,00000001,This circular device is the starburator for the Goliath's warp drive.,מכשיר עגול הזה הינו הכוכבורטור של מנוע העל-חלל הגולייתי.,,
1001.msg-3-1-0-1-,1001.msg,3,1,0,1,99,00000001,"A tritanium catwalk rings the massive star drive, allowing technicians to perform necessary maintenance functions.","מסלול טריטניום סובב את מנוע הכוכבים המסיבי, ומאפשר לטכנאים לבצע פעולות אחזקה שוטפות.",,
1001.msg-4-1-0-1-,1001.msg,4,1,0,1,99,00000001,A hatchway provides access through the bulkhead at the far end of the engine bay.,צוהר מספק גישה מבעד למחיצה בקצהו הרחוק של רציף התיקונים.,,
1001.msg-5-1-0-1-,1001.msg,5,1,0,1,99,00000001,The Goliath's state of the art stardrive can propel it at velocities greater than ten times the speed of light--which can make for a heinously expensive speeding ticket.,מנוע הכוכבים המתקדם של הגוליית מניע אותה במהירויות של פי 10 ויותר ממהירות האור--מה שעלול לסכן אותה בקנסות גבוהים על מהירות מופרזת.,,
1001.msg-6-1-0-1-,1001.msg,6,1,0,1,99,00000001,"This panel controls critical drive operations, including electrical functions.","לוח הבקרה שולט על פעילוית הנעה חיוניות, כולל התפקודים האלקטרוניים.",,
1001.msg-6-4-1-1-,1001.msg,6,4,1,1,99,00000001,You can't reach anything on the panel from where you're standing.,אתה לא יכול להגיע לשום דבר על הלוח מהיכן שאתה נמצא.,,
1001.msg-7-3-0-1-,1001.msg,7,3,0,1,99,00000001,"You knew this was a one way trip the moment you stepped into the EVA pod, Roger. There's no turning back now.","ידעת שזה כרטיס טיסה חד כיווני מהרגע שדרכת לראשונה על רכב החלל, רוג'ר. אין דרך חזור.",,
1001.msg-8-32-0-1-,1001.msg,8,32,0,1,19,00000001,"Wilco, here. Go ahead, Flo.","ווילקו, כאן. דברי, פלו.",,
1001.msg-8-32-0-2-,1001.msg,8,32,0,2,22,00000001,"Captain, the Goliath's warp drive is still off line.","קפטן, מנוע העל-חלל של הגוליית עדיין אינו מקוון.",,
1001.msg-8-32-0-3-,1001.msg,8,32,0,3,19,00000001,Is that bad?,זה כזה נורא?,,
1001.msg-8-32-0-4-,1001.msg,8,32,0,4,22,00000001,"If it isn't operational before the Eureka self-destructs, we'll all die!","אם הוא לא יהיה פעיל לפני שהיוריקה תשמיד את עצמה, כולנו אבודים!",,
1001.msg-8-32-0-5-,1001.msg,8,32,0,5,19,00000001,That |f8|is|f| bad! I guess I better do something about that while I'm down here.,זה |f8|אכן|f| נורא! מניח שכדאי שאעשה משהו בנידון בזמן שאני שוהה למטה.,,
1001.msg-8-32-0-6-,1001.msg,8,32,0,6,22,00000001,"Your penetrating analysis of the situation is as remarkable as ever, sir. Flo out.","ניתחת את הסיטואציה באופן מבריק ונוקב מתמיד, המפקד. פלו סוף.",,
1001.msg-9-1-0-1-,1001.msg,9,1,0,1,99,00000001,"The Goliath's drive bay houses a shevy small-block Star Reamer Warp Drive, capable of generating the equivalent of 350 Trillion newtons of thrust energy.","תא המנועים של הגוליית מאכלס מנוע על-חלל מחורר כוכבים בנפח בלוק קטן של שברולט, המסוגל לייצר שווה ערך ל-350 טריליון ניוטונים של אנרגיית דחף.",,
1005.msg-1-0-0-1-,1005.msg,1,0,0,1,99,00000001,The warp distributor cap snaps into its receptacle with a quiet click and the Goliath's star drive reawakens from its slumber...,מכסה מפלג העל-חלל ננעל למקומו בנקישה חרישית ומנוע הכוכבים של הגוליית מתעורר מתרדמתו...,,
1005.msg-2-1-0-1-,1005.msg,2,1,0,1,99,00000001,These status indicator lights register the operational readiness of the machinery that houses them.,אורות החיווי מלמדות על המוכנות המבצעית של המכונות המארחות אותם.,,
